,ProductId,UserId,ProfileName,Time,Text,Sentiment,Helpfulness,date,flag,sarcasm,Product,country,lang,url
571,B000G6RYNE,AWM1SL1PYY3A3,Joseph Orellano,1240272000,"These are among the best chips I have ever eaten!  I first came upon them when I visited a CostPlus World Market store in Opelika, AL, in the Tiger Town Mall, in 2007.  I wasn't a big fan of dijon-flavored anything, but I decided to give these chips a try.  I was hooked.  I probably ended up buying over a dozen bags within just a few months' time.  I searched all over my part of Alabama (the northwestern part of the state) and could not find them.  I later tried to find them at the World Market in Hoover, at the Patton Creek Shopping Center, and they did not carry this flavor.  However, when I learned that they were available on Amazon.com, and also available for PRIME Shipping - I bought them as soon as I read ""Kettle Chips Honey Dijon, 9-Ounce Bags (Pack of 12)!""<br /><br />You get a pretty big box, filled with 12 bags of these delicious morsels.  They last quite a while, but I will re-order, very, very soon!  I suggest you buy them, in this bulk form, and enjoy them - you won't be disappointed!  They go great with hamburgers and hot dogs - so they're perfect for spring and this coming summer's outdoor activities and cook-outs!<br /><br />Take my word for it, these chips are a hidden gem lost in the world of snack foods!  Buy some today, and fall in love like me!",1.0,0,2020-12-12,0,0,cauliflower,US,en,www.twitter.com/faoisejdfo/oijsd.html
572,B000G6RYNE,AW11YEHZRZ4D1,The Swatster,1238284800,I have never been addicted to anything in my life...until I tasted these chips.  I have tried other brands of the sea salt and vinegar flavor and they are just not the same.  You've got to stick with this blue bag of chips!,-1.0,0,2020-12-12,0,0,cauliflower,US,en,www.twitter.com/faoisejdfo/oijsd.html
573,B000G6RYNE,AX7K82LNPVATT,Marc2912,1222992000,I bought these when on sale through Amazon.  Nice crispy thick chips.  Definitely a great buy if you can catch them on sale.,1.0,0,2020-12-12,0,0,cauliflower,US,en,www.twitter.com/faoisejdfo/oijsd.html
574,B000G6RYNE,A2VQWV1HMW99AS,What's4dinner?,1317686400,"For those of you who, like me, had to order the Kettle Spicy Thai chips from Amazon because they are so hard to find locally, you will probably be aggrieved to know that the recipe has changed.  They are just like regular potatoe chips.  I paid for them but now my husband gets to eat them because he didn't like the spicy thai, but these are fine for him.<br /><br />Yuck!!!",1.0,1,2020-12-12,0,0,cauliflower,US,en,www.twitter.com/faoisejdfo/oijsd.html
575,B000G6RYNE,A1Q7A78VSQ5GQ4,"Nice Lady ""a reasonable person""",1249344000,"I've found a new taste treat. I'm not a big one for potato chips, so I am sure I've come late to discover these. I think they are really good.  The processing & ingredients list is actually pretty good-no trans fats, etc. So, if you want an indulgence, these are A+ !  They are thicker & more tasty than the mass produced potato chips we've all come to know.  They are much more flavorful.  Never had a honey-dijon potato chip before. Incredibly good & a flavorful combination of sweet, tangy, salty. Also not overly hot or spicy. Excellent!<br /><br />If you want a snack, have something REALLY good. It's got to be worth the calories-and these are!",1.0,0,2020-12-12,0,0,cauliflower,US,en,www.twitter.com/faoisejdfo/oijsd.html
576,B000G6RYNE,AV51MFS5XJXFP,candy lady,1349740800,This is a real good product.I love these chips and so does my customers can't go wrong wit these the best,1.0,0,2020-12-12,0,0,cauliflower,US,en,www.twitter.com/faoisejdfo/oijsd.html
577,B000G6RYNE,A20K6K9TZGX7RQ,Yoli,1349222400,I love these chips and now the whole family is hooked on them. These are the only chips I eat,1.0,0,2020-12-12,0,0,cauliflower,US,en,www.twitter.com/faoisejdfo/oijsd.html
578,B000G6RYNE,A2A8KWCE8RKB9T,David Glazer,1348704000,I don't know what to say that others have not covered. If you like potato chips you will like these. Get em on sale when you can and limit your intake...if you can...,0.0,0,2020-12-12,0,0,cauliflower,US,en,www.twitter.com/faoisejdfo/oijsd.html
579,B000G6RYNE,A27GRVH9ZJGXLT,patent_lawyer,1348185600,If you're looking at this you probably already know you like these chips.<br />This is a great deal and I have not had any problems with them going stale.<br />The 1oz bags are a great size for a snack and help avoid over-eating.,1.0,0,2020-12-12,0,0,cauliflower,US,en,www.twitter.com/faoisejdfo/oijsd.html
580,B000G6RYNE,A2E74M662DXAAR,"Randy Hardwick ""randyontheglobe""",1344038400,"While I admit that the oversalted chip is addictive, I really think this one has gone too far. Skin literally peeled off my lips and inside my mouth after eating these. I am surprised that they are still on the market.",1.0,1,2020-12-12,0,0,cauliflower,US,en,www.twitter.com/faoisejdfo/oijsd.html
581,B000G6RYNE,A3JJI4J8XAMK5Y,Mark H. Klemme,1338681600,"Only 5mg sodium per serving, chips are crisp.  I sometimes will dip in a low salt ketchup and that adds a bit to the flavor.",1.0,1,2020-12-12,0,0,cauliflower,US,en,www.twitter.com/faoisejdfo/oijsd.html
582,B000G6RYNE,A1CMTRQCJFV8L3,GLO,1334016000,"I have found this product, Kettle Chips Unsalted to be fabulous.  I found them by accident on Amazon after hunting all over my local stores.  They are crisp and tasty without all of the salt.",1.0,0,2020-12-12,0,0,cauliflower,US,en,www.twitter.com/faoisejdfo/oijsd.html
583,B000G6RYNE,A2R9GBWL1CDBN1,Rae K.,1333670400,"When I saw the Spicy Thai chips, I knew i had to try them. I love spicy and I love Thai food, so why not? First off, these chips are not super spicy. They actually taste sort of sweet at first, with many degrees of flavor. The spiciness is more of a lingering taste that bites afterwards. I'd say these are definitely a good, unique chip. But if you absolutely hate sweet chips, I'd try a different flavor since these are a little sweet.",1.0,0,2020-12-12,0,0,cauliflower,US,en,www.twitter.com/faoisejdfo/oijsd.html
584,B000G6RYNE,A3PSJEB2O37G8U,Amazon Fan,1328140800,"Smiles... Thank you Lord, for I have found another healthy snack food that is unsalted, and tastes great. I almost gave up on finding a potato chip like this. The only thing i would ask Kettle to change is the texture. It's slightly hard/crunchy, but not a problem at all. I would just prefer it to be softer. Kettle if you do make that happen, please keep everything else the same. Thank you.",1.0,0,2020-12-12,0,0,cauliflower,US,en,www.twitter.com/faoisejdfo/oijsd.html
585,B000G6RYNE,A2OEUROGZDTXUJ,J. Graves,1327968000,"These are my favorite, but they aren't for everybody. In a way, they sort of taste like Oriental flavor ramen, but with a kick. For me, how can one go wrong with the combination of jalapeno and ginger? They are a bit rich, so they aren't for EveryDayForAMonth snacking. Because this is a case purchase, I recommend trying out a single bag before buying an entire case. The 2oz size seems to be no longer available, which is a shame; I can eat the entire 5oz bag.",1.0,0,2020-12-12,0,0,cauliflower,US,en,www.twitter.com/faoisejdfo/oijsd.html
586,B000G6RYNE,A2933AO5D7O1T6,C. Blackwell,1327622400,Salt & vinegar chips are my favorite flavor so I think I've tried every brand out there.  These are by far the best.  I also like them because the sodium content is not very high like some of the others and they are not excessively greasy.  They seem to have the right balance of the salt and vinegar taste.,1.0,0,2020-12-12,0,0,cauliflower,US,en,www.twitter.com/faoisejdfo/oijsd.html
587,B000G6RYNE,A2NO1TXXS9T0EE,BruteNStones,1327536000,"Package arrived DOUBLE boxed, wrapped, and the inside box(that holds the goods) perfect not a single dent or rough mark, outstanding packaging.<br /><br />The Product?<br /><br />These are the best chips on the planet, Salt 'N Vinegar flavor is beyond among the best chips I've ever had. You might, actually I'm sure you probably won't like it AT FIRST BITE 'IF' you have never had these before. But try it again.<br /><br />Not to mention, this particular flavor has held up in numerous surveys and comparisons against other manufactures.",1.0,1,2020-12-12,0,0,cauliflower,US,en,www.twitter.com/faoisejdfo/oijsd.html
588,B000G6RYNE,A2II09GQGWOMTQ,"Brian Nallick ""METALMANMN""",1309478400,If you love jalapeno chips then Kettle is a must try.<br />Nice and cruncy with the kick of jalapeno.<br />Delicious.<br />Addicting.<br />Recommended.,1.0,0,2020-12-12,0,0,cauliflower,US,en,www.twitter.com/faoisejdfo/oijsd.html
589,B000G6RYNE,AQQLWCMRNDFGI,Steven A. Peterson,1306540800,"My son bought a package of the Jalapeno Potato Chips a couple weeks ago, and he and I have become addicted.<br /><br />First, Kettle chips appear to be somewhat better in terms of fats etc. than many other chips, as one peruses the dietary information.<br /><br />Second, individual chips are nice and crisp and have a good crunch value as you munch away at them.<br /><br />Third, the jalapeno has some kick (not overly hot, of course). Too many products labelled as spicy are not, have no kick, and are as bland as can be. Here, you do get a slow noticeable burn from the jalapeno. My preference? A bit more heat. But I understand that most consumers would prefer somewhat less than I would. Still, decent spicyness.<br /><br />All in all, I have been pretty happy with this product, in the few weeks since we first bought it. I now purchase a package each week in my foray to the local grocery store. . . .",1.0,0,2020-12-12,0,0,cauliflower,US,en,www.twitter.com/faoisejdfo/oijsd.html
590,B000G6RYNE,A24ZV048V7J0MT,"Murphy ""Goldenmom""",1293408000,"After looking at the pictures someone put on here showing a crushed box, I had to write a review.  I have bought these chips numerous times from Amazon Warehouse Deals and each time they came packaged perfectly.  There was a sale at the end of the summer and I received a few cases/boxes for just over $10.00.  The chips were fresh and very hard to eat just one bag.  I hid them in the garage and only remembered them when I went out there; that way I didn't eat them all.  As far as the pictures, if the person contacted Amazon, he made out ok.  Amazon is great with handling complaints and this person was given perfect customer service if he called Amazon.  Thanks for a great tasting product, good price and quick shipping.  I'll buy these again...soon.",1.0,0,2020-12-12,0,0,cauliflower,US,en,www.twitter.com/faoisejdfo/oijsd.html
591,B000G6RYNE,A3L5L1NZIKLSJU,"E. Demir ""emiko""",1289433600,"There is nothing too good or too bad about these chips. If you like plain potato chips, you'd like these. They are thicker than most brands, fresh out of box, very crunchy and not too salty (for me). One bag has a lot, I generally cannot finish it by myself. Part of the reason is that they are too oily (some chips almost look transparent, if you know what I mean). The taste of oil is a bit too overwhelming for me. If you are used to more spicy chips you may not like these since they do not have any spice, except salt, as the name says. I don't think I'll buy these again. The ""best by"" date on my bags are March 2011 and I ordered them at the end of October.",1.0,0,2020-12-12,0,0,cauliflower,US,en,www.twitter.com/faoisejdfo/oijsd.html
592,B000G6RYNE,A5U1K1NRQEZW9,"L. Wang ""L. Wang""",1288310400,"I love this sea salt & vinegar flavor from Kettle.  When I saw this one on the daily deal here for $17.99/case, I put my order without doubt.  However, when I received the case, I found out that the whole case is expiring in December while I got it at the end of August.  I tried one package and I can definitely taste the unfreshness in the chips.  I was disappointed and then I found out this item is not returnable!  How convenient!  Although I love this chips, I won't order from here again with the concern of close expiration date...",1.0,1,2020-12-12,0,0,cauliflower,US,en,www.twitter.com/faoisejdfo/oijsd.html
593,B000G6RYNE,A216YA3CYXIOGI,lady in the south,1280620800,"This is the second purchase of Kettle Potato Chips and we love them just as much as the first time we tried them. We bought them by the a carton of 24 bags. The Kettle chips were in a 2oz bag which is just enough for a single size serving snack or with a meal. The chips are so delicious, baked not fried and lightly salted with Sea Salt. They have 0 fat, no preservatives, nothing artificial and they only use real food ingredients. What more could you ask for in a great tasting chip!",1.0,0,2020-12-12,0,0,cauliflower,US,en,www.twitter.com/faoisejdfo/oijsd.html
594,B000G6RYNE,A20FQULBVVWA8B,"L. Ljunghammar ""Eclectic Scout""",1266796800,"How to achieve potato chip nirvana? It's simple:  Buy these chips, get them tomorrow, eat them!<br />Repeat.<br /><br />Why?<br /><br />Best ""old school"" BBQ flavor out there<br />Kettle quality<br />Incredible price with Amazon<br /><br />Did I mention delicious and a terrific bargain?",1.0,0,2020-12-12,0,0,cauliflower,US,en,www.twitter.com/faoisejdfo/oijsd.html
595,B000G6RYNE,A1LFB8KRBI9IE2,"Kenneth Holmes ""flippper60""",1257206400,"I found these more than 10 years ago in a health food store. After I bought one bag I found myself stopping by that store once a week to get these chips. The New York Cheddar flavor is so good, you will have a hard time not eating a whole bag.",1.0,0,2020-12-12,0,0,cauliflower,US,en,www.twitter.com/faoisejdfo/oijsd.html
596,B000G6RYNE,A2N10M1J3KJZK4,MT_Soul,1249084800,But you will enjoy ever step. I gained 5 lbs within a month of buying this 12 pack of full sized bags. Damn it! They should warn you about this! Tastes awesome though. When I finish my crash diet I will order another box (case?). :-),1.0,1,2020-12-12,0,0,cauliflower,US,en,www.twitter.com/faoisejdfo/oijsd.html
597,B000G6RYNE,A3NXBP212KFH5X,Andrew D. Vorrath,1246406400,"These are the best spicy chips I have ever had the pleasure of eating.  They start off sweet, then as you eat more the spice builds up.  They are fantastic.  If you don't want to commit to a whole case, pick up a bag at your local Whole Foods first, then stock up here when you realize how amazing they are.  Got my case right here, and loving every bite.  On a side note, this brand (Kettle Brand) has many delicious varieties- this is just my personal favorite.  I also highly recommend: Backyard BBQ, Honey Dijon, Sweet Onion, Buffalo Bleu, Salt and Pepper and Death Valley Chipotle.  Lays aint got nothin on Kettle Brand!!!",1.0,0,2020-12-12,0,0,cauliflower,US,en,www.twitter.com/faoisejdfo/oijsd.html
598,B000G6RYNE,A3RMGIKUWGPZOK,Jean Visnefski,1245024000,"I've eaten other brands of unsalted potato chips and they've always been terrible.  I didn't expect much when I bought these.  But after I tasted them I was amazed.  I have never enjoyed unsalted potato chips before these.  They have a natural potato flavor with thick, crunchy chips.  The only bad thing is the bag is a pain to open.  Use scissors and save yourself the aggravation.",-1.0,0,2020-12-12,0,0,cauliflower,US,en,www.twitter.com/faoisejdfo/oijsd.html
599,B000G6RYNE,A3PM9DMVYG9HDK,"Yuni ""nut_stud""",1242259200,"Kettle brand chips are probably the best potato chips I've tasted thus far. They are thick, has a bite to them and I love their creative flavors. My favorite Kettle chip happens to be the honey Dijon. I think it's a great combination sweet, salty and tangy, perfect for one of those snack attacks when you don't know exactly what you want. I especially love the curled up chips for extra texture and crunch. These 2-oz bags are perfect for anyone who has a problem controlling portions (like me!).",1.0,0,2020-12-12,0,0,cauliflower,US,en,www.twitter.com/faoisejdfo/oijsd.html
600,B000G6RYNE,A3PJZ8TU8FDQ1K,Jared Castle,1237075200,"As an Oregonian, I make a point of sharing these Oregon-made snacks with friends who visit the state. I tell them the Kettle Brand does for potato chips what microbrew does for beer.<br /><br />Kettle Brand potato chips are unmistakable--a light gold color, rich flavor and amazing crunch. Kettle Brand chips are also a healthier snacking option than the major chip brands. Kettle Brand chips don't have trans fats, MSG or artificial flavors and colorings. The company also has a line of organic potato chips and all of their products are certified Kosher.<br /><br />Annette Solomon, a reporter for the Salem Statesman Journal noted that a glass of wine goes nicely with Spicy Thai chips. Solomon wrote, ""...you could be missing out on a wonderful pairing. These chips are spicy, so you would want to select a semi-sweet white wine. Also, a moderate amount of acid will subdue the strong flavors of ginger, lime, garlic and cilantro without over-powering them. Classically, a German-style Riesling fits these parameters perfectly.""<br /><br />I also recommend <a href=""http://www.amazon.com/gp/product/B000G6MBV4"">Kettle Chips Honey Dijon</a> and <a href=""http://www.amazon.com/gp/product/B000G6MBUA"">Kettle Chips Sea Salt & Vinegar</a>.<br /><br />The Honey Dijon chips bring a terrific balance of salty, tangy, sweet and crunchy. Other brands I've tried use too much mustard flavor, which overpowers the Honey Dijon pairing. The Honey Dijon chips make a great side dish on a BBQ plate with baked beans, coleslaw or potato salad and grilled meat. Naturally, they also go down great with beer.<br /><br />The Sea Salt & Vinegar chips are a perfect complement to vegetable trays of cucumber, carrot, celery and cherry tomatoes. Skip the dip; balance the tangy chips by alternating bites of raw vegetable.<br /><br />In summary, I highly recommend Kettle Brand chips, a great buy on Amazon.com.",1.0,1,2020-12-12,0,0,cauliflower,US,en,www.twitter.com/faoisejdfo/oijsd.html
601,B000G6RYNE,A2TMSO255FQBBU,Brian H. Goldberg,1218758400,"Kettle chips are thicker and crunchier (though greasier at times) than other chips, and the honey dijon flavor is great.  They don't have the overwhelming salty taste some cheaper chips have, and the 2oz size is great for an adult size snack.",1.0,0,2020-12-12,0,0,cauliflower,US,en,www.twitter.com/faoisejdfo/oijsd.html
602,B000G6RYNE,A20ORC60J05BP3,M. Novak,1217289600,"I've always liked Salt and Vinegar chips but most of the time the stronger flavor was at the bottom of the bag. Not with these, the vinegar is overflowing right from the first chip and doesnt stop until you've finished the bag. These are very addictive. If you like salt and vinegar, these are the ultimate chips. Nothing else compares.",1.0,0,2020-12-12,0,0,cauliflower,US,en,www.twitter.com/faoisejdfo/oijsd.html
603,B000G6RYNE,AYSEXV27DPQ3E,"Jilla ""Jilla""",1217203200,"Tasted good. Spicy. Those that don't like spicy should stay away from this. For the price paid, very good buy.",1.0,0,2020-12-12,0,0,cauliflower,US,en,www.twitter.com/faoisejdfo/oijsd.html
604,B000G6RYNE,AX668BUQRHI7C,stephie,1216598400,"These are seriously delicious, especially if you like plain potato chips. My only concern is they're very oily. I understand they're ""kettle chips"" and they're ""fried"" (small batches and all) but when you open the bag (That's another thing, very strong bag! Need scissors!) there's a coating of oil on the inside of the bag and on the chips themselves. I suggest a blot/shake on some paper towels before consuming. Either way, they have a yummy potato taste, and very satisfying crunch. Delicious!",1.0,0,2020-12-12,0,0,cauliflower,US,en,www.twitter.com/faoisejdfo/oijsd.html
605,B000G6RYNE,A3MPHBL698EET7,Alex D. Berg,1215475200,"This bags are very difficult to open with the aid of some tool, such as scissors, don't even try without scissors.<br /><br />They are crispy and taste like chips that aren't advertised as being salted. They definitely aren't healthy, because I can feel the grease all over my fingers when eating them, and I can see the grease at the bottom of the bag, too.<br /><br />They are high-quality chips, and deserve to be put on your table.",1.0,0,2020-12-12,0,0,cauliflower,US,en,www.twitter.com/faoisejdfo/oijsd.html
606,B000G6RYNE,A1LA5T5SXLGFZQ,"Halcyon Moses ""GoGreenMart&More.com""",1215129600,"Kettle Foods, Inc. makes the best tasting potato chips I've ever eaten.  With a variety of flavors, from classic Barbeque to their unique Spicy Thai you'll find the right flavor for your mouth. And not only do they taste wonderful, but these all-natural chips are cooked in safflower or sunflower oil for zero cholesterol.<br /><br />But why is it a GoGreenMart&More product of the week? Kettle Foods, Inc. is a ""Green Giant"", a company highlighted for their environmental practices.  They convert waste oils to biodiesel to power some of their company cars. A roof-top solar panel system creates 120,000kWh annually for production and they offset 100% of their additional U.S. energy usage by buying renewable energy credits. Not only are their efforts for the future but they care for the present by rejuvenate a neighboring 2 acre wetland eco-system. And during recent building construction, they earned a Gold rating from Leadership in Energy and Environmental Design (LEED).<br /><br />Now your mouth will thank you and so will the environment.",1.0,1,2020-12-12,0,0,cauliflower,US,en,www.twitter.com/faoisejdfo/oijsd.html
607,B000G6RYNE,A2YKWYC3WQJX5J,"Shannie ""Shan""",1212451200,These really are amazing chips. Don't be put off by one of the cheeses being blue cheese...it is so subtle that even blue cheese haters (like me)will enjoy these.,1.0,1,2020-12-12,0,0,cauliflower,US,en,www.twitter.com/faoisejdfo/oijsd.html
608,B000G6RYNE,A1JBB01LAK69LV,Rubyred,1212105600,"These chips are delectably delicious. I am on a low sodium diet. I didn't have to give up totally something that I truely love to snack. These chips are bursting with flavor, and you can't really tell they are missing all that salt. There is just a kiss worth on a chip, but beleive me, it is a total makeout!!!",1.0,1,2020-12-12,0,0,cauliflower,US,en,www.twitter.com/faoisejdfo/oijsd.html
609,B000G6RYNE,AKMEY1BSHSDG7,J. Arena,1202774400,"Not too salty like regular supermarket chips, this is a snack that will not overwhelm you with guilt! When you just gotta have some chips, Kettle Chips Lightly Salted chips are the what you've been searching for.<br /><br />There's no cholesterol, no trans fats, no artificial anything -- and because of the manufacturing process, they actually seem to have kind of a home-made quality.<br /><br />This is an excellent product!",1.0,0,2020-12-12,0,0,cauliflower,US,en,www.twitter.com/faoisejdfo/oijsd.html
610,B000G6RYNE,A2F7GUZ4UMVHFL,James Walters,1186876800,"I agree with the company motto ""A Natural Obsession"".  I tried a small bag at the local store and immediately bought in bulk online to save about 30 percent.  The flavor of these is very strong, so they are best paired with a food that has a very mild flavor, like steamed vegetables or plain whole grain bread.  Otherwise they compete or clash with the other food.",1.0,1,2020-12-12,0,0,cauliflower,US,en,www.twitter.com/faoisejdfo/oijsd.html
611,B000G6RYNE,A3RO3CGZ9MWA1I,L. Cabrera,1178236800,"The New York Cheddar flavor is my favorite of all the Kettle Brand potato chips. These are flavorful and crunchy and will make your mouth happy. Unfortunately, it may do the opposite to your backside, so don't do what my mom did and eat an entire bag on an empty stomach or you may spend the afternoon in the bathroom.<br /><br />I still give it a 5 of 5 stars.<br /><br />Also, the online price at Amazon is better than anywhere else I've seen them. Combined with Amazon Prime you'll be getting a great deal on these chips.",1.0,0,2020-12-12,0,0,cauliflower,US,en,www.twitter.com/faoisejdfo/oijsd.html
612,B000G6RYNE,A37D5847LN3WQ,Wildcat Fan,1211414400,These are my new favorite!  I have always been a fan of salt and vinegar but these honey dijons have replaced them as my new number one!  They do have a strong taste so loving the honey mustard flavor is a must if you hope to like these.<br /><br />Price wise...I do not see that they are that much of a deal here.  I purchased them for $2.99 at the grocery with no shipping.  I would have given the product 5 stars (easily) had it not been for the price.  The taste is fabulous -- you won't be disappointed.,1.0,0,2020-12-12,0,0,cauliflower,US,en,www.twitter.com/faoisejdfo/oijsd.html
613,B000G6RYNE,A1GV4HEM6XZC06,Catherine Taylor,1197936000,These chips were good. I ended up eating a whole bag a day for a while cause they were so good. I am glad that they do not have any dextrose in them like lays do.,1.0,0,2020-12-12,0,0,cauliflower,US,en,www.twitter.com/faoisejdfo/oijsd.html
614,B000G6RYNE,ABCXJIXC6Q6EB,Arthur Kang,1194307200,these are the best chips out there.. nothing can beat this taste. if you like honey mustard then you will definitely like this.. once you eat it you wont stop..addicting stuff,1.0,0,2020-12-12,0,0,cauliflower,US,en,www.twitter.com/faoisejdfo/oijsd.html
615,B000G6RYNE,A3MTY0ZE9WYJHL,"Earl M. Rce ""ezdouble07""",1191110400,I dont know if they were fresh or if they were supposed to taste like they did. I checked the expiration date it was current but still tasted kind of stale to me !!!,1.0,1,2020-12-12,0,0,cauliflower,US,en,www.twitter.com/faoisejdfo/oijsd.html
616,B000G6RYNE,A3E9OJWHMXMYYF,AnneSAHM,1180310400,"At first I was thinking, ""cheese flavored chips?""  But I love them.  The herbs they used are just delicious.  The cheese is not overpowering.  They are yummy and crispy!!",1.0,0,2020-12-12,0,0,cauliflower,US,en,www.twitter.com/faoisejdfo/oijsd.html
