,ProductId,UserId,ProfileName,Time,Text,Sentiment,Helpfulness,date,flag,sarcasm,Product,country,lang,url
859,B000VKYKTG,A3KTOA1CBPBBC0,Donuts,1308787200,"I bought these back in January and never got around to reviewing them. I had heard many people rave about a Japanese snack called Pocky so I figured I would try it out. Just like the description states, its a biscuit stick covered in chocolate. I wouldn't say the taste is mind boggling but its very easy to eat and virtually no mess, well, as long as the chocolate doesn't melt. Anyways, in case anyone is wondering, I ordered from a seller named Very asia (amazon.com/gp/help/seller/at-a-glance.html?ie=UTF8&isAmazonFulfilled=0&orderID=103-7071944-5595443&marketplaceSeller=1&seller=A3JW437I54SEI1). I believe it took around a 3 weeks to actually get to me (maybe it had to be imported) but when it did, it came well packed and not damaged whatsoever. I'm definitely considering re-stocking on this in the future if I can't find a local store<br /><br />EDIT: Oct 11, 2012<br /><br />*****Inquire the type of pocky from seller before finalizing purchase*****<br /><br />So I decided to restock after I couldn't fight the craving anymore. Unfortunately the batch this time was not so good (ordered from different seller because it was cheaper and through Amazon Prime). What I received was not the picture shown on the front page (2 per pack japanese pocky), it was a 1 per pack pocky~ish thing from Thailand. In my opinion, the 1 giant pack compared to 2 smaller packs is definitely a step back. Packaging was fine and I ordered in October when the weather was a bit cooler aka no melted chocolate arriving at the front door. The sticks were coated in some type of thick chocolate that was a bit bitter to the taste, more similar to dark chocolate than milk chocolate. The original Japanese pocky melted almost immediately in your mouth, this one melts slowly as it sits in your mouth.<br /><br />Personally I like the taste of dark chocolate but not when used here as a pocky flavor. I also have terrible self control so I buy things that come in small portions in order to a) not eat everything at once and b) avoid making the fridge a mess by cluttering it with tons of opened items. I can honestly say that I won't be overeating when it comes to this batch of pocky because I and my stomach dislike it so much. I won't change my original rating because that still holds true for the Japanese pocky but if I were to rate only the Thailand pocky it would be a 3. The taste isn't ""terrible"" but its definitely not to my liking. If possible I will be uploading some pictures of what I received.",-1.0,1,2020-12-12,0,0,cauliflower,US,en,www.twitter.com/faoisejdfo/oijsd.html
860,B000VKYKTG,A16V3EN9C3K83W,Sweetiewee,1308700800,Bought these for my daughter's Grad party as well as the Strawberry. She loves these things. They're a great product.,1.0,0,2020-12-12,0,0,cauliflower,US,en,www.twitter.com/faoisejdfo/oijsd.html
861,B000VKYKTG,A32OZFDUK07WLV,"R. G. Pickering ""ritapick""",1280534400,Everyone in our family except one really likes the taste of this.  It is addicting.  That includes our 3 year old.,1.0,0,2020-12-12,0,0,cauliflower,US,en,www.twitter.com/faoisejdfo/oijsd.html
862,B000VKYKTG,A1WX42M589VAMQ,Mir,1278288000,"Pocky is just plain fun to eat. I discovered these snacks at an anime convention (though I'd heard about them before and had seen manga characters eating them). They are very, very slim sticks of biscuity stuff (the flavor to me is a cross between waffle cones and pretzels) that have a charming tiny popping crispness. The chocolate flavor, a nice non-bitter, non-dark, generically pleasing choco-taste, seems to be the most popular (given how fast they sell out at cons), but I prefer the flavor of the strawberry which is like strawberry ice cream. Very nice.<br /><br />This is by no means a health food (it's in the same category as a cookie, it's got fat and sugar and non-healthful ingredients). But hey, it's junk food. We all know it's supposed to be OCCASIONAL and not habitual in the diet. Unless you're really prone to binge-eating or can't stop yourself a whole one of these smaller boxes is not a huge calorie splurge if you stick to a reasonable number. 10 of the chocolate pocky sticks will set you back 125 calories with 5 grams of fat, 3 of them saturated. I wouldn't recommend just scarfing down multiple boxes. In fact, just nibble these slowly and have fun with the cool texture effect.<br /><br />If you love the flavor of coconut-chocolate together (like Almond Joy) try the coconut chocolate ones. They're really so good, oh man. Hubby says the taste reminds him of the Girl Scout 'caramel delights"" cookies which are, in turn, similar to the old Yes Yes cookies (from the seventies or so).<br /><br />Anyway, if you have read manga or seen anime with young folks eating those stick-looking treats, or seen footage of cute Japanese girls nibbling at skinny little stick treats, this is what they were eating. :) Fun treats.<br /><br />However, with this crazy hot summer, I'd recommend you look for a local retailer or wait until fall's cooler weather. You might get a sticky, clumped mess of Pocky sticks in this deep summer weather. (Look for local stores that specialize in Japanese anime or manga and they'll likely carry Japanese snacks like these. In South Florida, Tate's Comics has them in a variety of flavors..and FRESH and NOT MELTED).",1.0,0,2020-12-12,0,0,cauliflower,US,en,www.twitter.com/faoisejdfo/oijsd.html
863,B000VKYKTG,A3EGP5QU70NRKA,S. Srinivasan,1251936000,"Pocky is an incredibly good snack, but more than that, I was impressed with Very Asia's packaging. I had stupidly ordered something as easy to melt as chocolate in the dead heat of summer. On top of that the package of dessert pocky I ordered in 100 degree weather melted into this liquid goo. T_T So of course I was expecting all the pocky in my 10 boxes to be melted away, but they took the special care to put the pocky in a box reading ""PROTECT FROM HEAT"" and my pocky arriving in perfect condition! (Well, they did stick together just a bit). I love Very Asia more than anything now.",1.0,0,2020-12-12,0,0,cauliflower,US,en,www.twitter.com/faoisejdfo/oijsd.html
864,B000VKYKTG,A3LRR63WLQ3N3O,YOToyo,1351123200,"I think the Pocky did not get stored rightly. The chocolate was falling off from the biscuit stick, and doesn't taste as it should. Many of them stick together, and whenever I want to split them up, it just becomes very messy. Now I need to clean up my desk every time after I have it.",1.0,0,2020-12-12,0,0,cauliflower,US,en,www.twitter.com/faoisejdfo/oijsd.html
865,B000VKYKTG,A35MKC4WRQ8M8F,Grael,1346716800,Everyone loves Pocky and if they say they don't they are lying lol. The Pocky arrived in good condition with minimal melting and very few broken pieces.,1.0,0,2020-12-12,0,0,cauliflower,US,en,www.twitter.com/faoisejdfo/oijsd.html
866,B000VKYKTG,A1C1Y0S6QPBM4W,R. Dzuris,1231286400,"These where great couldnt stop eating them.<br />Lowest priced anywhere and will buy even more next time.<br />Cant say enough about these, they where shipped faster than what I paid to have shipped also.<br />Thank you so much.",1.0,0,2020-12-12,0,0,cauliflower,US,en,www.twitter.com/faoisejdfo/oijsd.html
867,B000VKYKTG,A11VPI6WLMQ2ZQ,"Lee A. Vercoe ""TangSooPap""",1199059200,"I had bought Pocky when on vacation and enjoyed it but living where there are no Asian stores I have to shop on the internet. The guys in the family seem to like it better than the ladies for some reason. For a bit of insanity, search for Pocky commercials on youtube!",1.0,0,2020-12-12,0,0,cauliflower,US,en,www.twitter.com/faoisejdfo/oijsd.html
868,B000VKYKTG,A9T4HGTPSJ27N,Rolland M. Favre,1277596800,The individual Pocky sticks are not separately packaged and melt and stick together while being shipped.,0.0,0,2020-12-12,0,0,cauliflower,US,en,www.twitter.com/faoisejdfo/oijsd.html
869,B000HDMUQ2,A1I985U2CK6R97,"Steve B ""Steve""",1276646400,"This product must qualify for some sort of deceptive packaging award. The box only contains 5 bars and the wrappers are smaller than normal, so at least 50% of the interior of the box is air. Then when you unwrap the bar you find they are only about 60% the length of a ""normal"" snack bar. The rest of it is empty air inside the wrapper. If they were to not include wrappers those 5 bars would occupy less than 25% of the space inside the box.<br /><br />As far as taste goes they are so-so. On the dry side with a hint of berry flavor. Celiacs, who are used to inferior products, won't be disappointed in the taste of this one.<br /><br />I've also had their cookies and they suffer from the same sort of deceptive packaging. The picture on the side of the box shows what most of us would consider a normal sized cookie. But when you open the box you find that it mostly contains a plastic tray holding cookies about the size of a quarter.<br /><br />I really want to like this company. They seem to be trying hard and coming out with new products and keeping allergens out of the production process. That is why I've continued to try their products. I bought their granola many times, always wanting to like it, but it is some of the worst food I've ever had. The ""clusters"" are hard as the partially popped kernels at the bottom of your bag of popcorn and more fitting for gerbils than people.<br /><br />All in all I would not recommend Enjoy Life foods.",-1.0,1,2020-12-12,0,0,cauliflower,US,en,www.twitter.com/faoisejdfo/oijsd.html
870,B000HDMUQ2,A2E3WMF9RWW2X2,K. Duvall,1225670400,This was the first peanut free product I bought for my son.  I thought they were tasty.  The kids liked them too.  For some reason they think they are strawberry bars.  I love the soft texture and the non crumbly state.  It makes for clean car rides.  Since then they like the apple and chocolate bars the best.  Berry is always left for last.  Amazon has a wonderful price and I just wish it could be a subscribe item.,1.0,0,2020-12-12,0,0,cauliflower,US,en,www.twitter.com/faoisejdfo/oijsd.html
871,B000HDMUQ2,AJY5Y3SHROG5C,A. Grillet,1215561600,"I have recently stopped eating a number of allergens (dairy, soy, nuts) and these were one of the few snacks which fit into my dietary restrictions.  Unfortunately, these were pretty gross - miserable texture and more cardboard flavored than berry.  I threw them away.  I would recommend the cocoa ones as they are much tastier and also allergen free.",1.0,1,2020-12-12,0,0,cauliflower,US,en,www.twitter.com/faoisejdfo/oijsd.html
872,B000HDMUQ2,AJW40ZXGT8ITY,K. ULLRICH,1293753600,"My daughter had extensive food allergies as an infant/toddler and we bought these bars consistently.  She still has the nut and egg allergy so I like that I can trust the manufacturer and know the food is safe.  Unfortnately the last few times we have purchased the bars (all varieties) they have been hard as a rock and my daughter won't eat them.  I have tried them myself and thought I might break a tooth. I had them on subscribe and save; which I have now cancelled and have several boxes which no one in my family will eat.  I agree with a previous post. I want to love these bars and I love everything the company stands for (and actually really like their cookies), but something has changed with these bars and they are just not even appetizing.  I hope they address the issue and I will certainly try them again if they do something to enhance the taste and address the issue with the texture. A total bummer -  they were better in the past but something changed with the taste, along with their new packaging!!",1.0,0,2020-12-12,0,0,cauliflower,US,en,www.twitter.com/faoisejdfo/oijsd.html
873,B000HDMUQ2,AGC3K4KSI67RI,Joanne Macek,1184544000,My son with multiple food allergies really enjoys these bars.  I find that they have a good berry taste.  They also have a nice chewyness.,1.0,0,2020-12-12,0,0,cauliflower,US,en,www.twitter.com/faoisejdfo/oijsd.html
874,B000HDMUQ2,A30NECNFHHBT3H,lp,1340236800,i love them. not too sweet but just right. any allergy free food is great in my book. hope non of these ingredients contains Corn...thats a no no for me too. HOWEVER I DONT APPRECIATE THE FACT THAT I OPENED MY NEW BOX AND THE CUT 1/4 OF IT OFF. IF THE SIZE IT LESS THEN SO SHOULD THE CHARGE. THIS WILL EFFECT MY DECISION IN BUYING AGAIN. I AM NOT A TODDLER I NEED A REAL SIZE BAR PLEASE,1.0,0,2020-12-12,0,0,cauliflower,US,en,www.twitter.com/faoisejdfo/oijsd.html
875,B000HDMUQ2,A1TCNR6ULOEDOQ,Nursebabe,1329782400,"I was extremely disappionted when I opened my shipment of Enjoy Life On The Go Bars (Very Berry, Carmel Apple, and Cocoa Loco). The boxes are now a plain, generic design..you know, the kind all brands change to when they want to make their products look cheaper. I then compared the ingredients of the new shipment with the older boxes I still had at home. Guess what?! Cheaper ingredients! Next, I taste-tested, and let my 3 year old help. He wouldn't eat the new ones...and I can't blame him. They are oily and bland. I thought Enjoy Life was a brand that actually cared about using quality ingredients to make a good-tasting product. I was wrong. In summary, these are way too expensive to be made with low-quality, unpalatable ingredients.",1.0,0,2020-12-12,0,0,cauliflower,US,en,www.twitter.com/faoisejdfo/oijsd.html
876,B000HDMUQ2,A3SM576V5911MB,M. Tempel,1325030400,Refer to the picture I posted above.  The bar is half the size you think it is going to be...It is literally a two-bite bar.  Very deceptive advertising.  That and the fact that they are ridiculously expensive is the reason for the one star.  My 10 year old son ate one and didn't like them. I ate one and agreed as did my husband.  Couldn't give it away!  Everyone has different tastes but these are no tasty treat as far as I'm concerned.,-1.0,1,2020-12-12,0,0,cauliflower,US,en,www.twitter.com/faoisejdfo/oijsd.html
877,B000HDMUQ2,A3223MR0RBJG6H,"AlmondJoy ""almondjoy""",1317254400,"With all the allergies in our family, these ended up working out great.  We don't have any negative reactions to the ingredients and though we don't buy many pre packaged foods, these work for 'on-the-go'. Our family tried several varieties and I prefer the Cocoa Loco Bars; they're almost like a Tootsie Roll to me-though I can't eat Tootsie Rolls, so this is a great substitute for that occasional craving.  My family prefers the Very Berry Bars because they can eat those when they miss breakfast, need a healthy snack, or my son will take them on his cross country running meets.  They are very dense and filling-not a 'soft bar' and we always eat them while having some liquid to drink at the same time.",1.0,0,2020-12-12,0,0,cauliflower,US,en,www.twitter.com/faoisejdfo/oijsd.html
878,B000HDMUQ2,A1Y1L56592H2ZX,Kimmy in Valencia,1314057600,"I'm new to food allergies.  My 6mo son was diagnosed with some severe FA and since he's still breastfed, I had to drastically alter my diet.<br /><br />Before learning about this brand, I was stuck eating chicken breasts with potatoes for every meal.  So when I stumbled upon this at my local Whole Foods, I was very excited to try it.<br /><br />Overall, I really like them.  It's got pretty good texture, taste and heft.  It's not so dense that you want to gag after two bites but also not so light that you can eat the whole box (which really isn't that big).<br /><br />I know alot of people complain about the size/packaging and I agree somewhat.  But each bar is an ounce and 120 calories... on par with many other breakfast bars.  I like the Berry flavor the best, it's the closest to real, non FA specialty flavor. Overally, I'm grateful for these bars because now I can tote several in my diaper bag and car and know that when I really need a quick snack, I won't be left stranded.",1.0,0,2020-12-12,0,0,cauliflower,US,en,www.twitter.com/faoisejdfo/oijsd.html
879,B000HDMUQ2,A3NH41GQPFMGQS,"Kimberly A. Shuber ""Kimshu""",1291420800,My son has severe allergies.  This is an item he loves and is a convenience for me.  I feel good giving them to him and they taste great!,1.0,0,2020-12-12,0,0,cauliflower,US,en,www.twitter.com/faoisejdfo/oijsd.html
880,B000HDMUQ2,A2D293ADQ5HCLF,Blish,1274832000,"Tasty, convenient bars for people with celiac disease. They seem to have gotten smaller over time, but the taste and convenience outweigh the reduction in size (and the price).",0.0,0,2020-12-12,0,0,cauliflower,US,en,www.twitter.com/faoisejdfo/oijsd.html
881,B000HDMUQ2,A17Q17AR5GN2SH,S. Hartman,1268611200,If you are looking for a great gluten free snack you won't be sorry you chose this product. My favorite flavor is the apple and nut.,1.0,0,2020-12-12,0,0,cauliflower,US,en,www.twitter.com/faoisejdfo/oijsd.html
882,B000HDMUQ2,A3W4RLOQQ2R4RT,"Courtney Aie ""Court ;)""",1268352000,"This brand of granola bars are really good.  The very berry are my favorite.  However, the bars are almost ridiculously small.  Yeah, we're gluten free, so our food is a lot more dense than other food, but honestly, can we not have normal sized, good tasting granola bars?  They really are tiny.  So, the taste is GREAT but the bar is small.",1.0,0,2020-12-12,0,0,cauliflower,US,en,www.twitter.com/faoisejdfo/oijsd.html
883,B000HDMUQ2,A2AV6EYCQ5OA30,grandMOM,1267142400,"They are OK, but my husband only eats them when we are in car. We keep them there for a celiac snack. (Hard to find when roaming around.) He won't eat them otherwise. They are definitely raspberry, but are kind of dry.<br />  We have never tried any other snack bars, so in all honesty they may be the norm. I don't know.<br />  We DO like Enjoy Life's other products.<br />  They are GF, have no MSG or related products or aspartates.",1.0,0,2020-12-12,0,0,cauliflower,US,en,www.twitter.com/faoisejdfo/oijsd.html
884,B000HDMUQ2,AR37BG23UFBF6,"Cheryl Walser ""cello jello""",1242691200,Great taste. Great ingredients. Great texture. Absolutely delicious! They are a little smaller and you may still be hungry if it is for a meal. I give one to my 5 year old son for breakfast and he is still a little hungry for more. Either that or they taste so good he wants more.,1.0,0,2020-12-12,0,0,cauliflower,US,en,www.twitter.com/faoisejdfo/oijsd.html
885,B000HDMUQ2,A2EZOWS34XH567,"Koehler ""bonnierabbit""",1235692800,"Recently diagnosed a gluten-intolerant, I have been looking for products that allow me to resume a semblance of my former life. These snack bars fit the bill. They have the mouth-feel of a traditional snack bar, and a pleasant tart-sweet fruit flavor.",1.0,0,2020-12-12,0,0,cauliflower,US,en,www.twitter.com/faoisejdfo/oijsd.html
886,B000HDMUQ2,ACSALMTTUS776,Best Busy Boys,1216166400,"My son Loves these ""fruit bars"" they are smaller than your typical wheat fruit bars.  My suggestion it to get your child to like these first before you try the chocolate ones... Now my son favors them (chocolate) ones MORE than the berry ones...",1.0,0,2020-12-12,0,0,cauliflower,US,en,www.twitter.com/faoisejdfo/oijsd.html
887,B000HDMUQ2,A1XKHPDL7JJBK5,"Pamela Garland ""celiac""",1206835200,"If you want a really good snack bar try these, they are healthy and taste as good as any granola bar, but without the gluten!! I buy these regularly.",1.0,0,2020-12-12,0,0,cauliflower,US,en,www.twitter.com/faoisejdfo/oijsd.html
888,B000HDMUQ2,A1B1QMGK8VYG80,Dan Seidman,1308787200,"Imagine taking some kids' playground chalk, perhaps that tan colored one and grinding it into powder with plenty of chunks. Then scoop it up and put it in your mouth.<br /><br />That's how disgusting this bar is.<br /><br />I have no idea how and who is rating this as flavorful, IT HAS NONE. I've done nutritional coaching for 30 years and watched healthy foods progress from painfully bad to barely edible to excellent.<br /><br />This neanderthal-era gluten free bar is so bad I want to go to my local grocery store, take all the boxes off off the shelf and hide them in a different part of the store (perhaps, if there's a trash compactor?) just to protect people from the experience my daughter had with this product.<br /><br />Save your money for these ridiculously expensive and spend it on anything else.<br /><br />""Enjoy Life"" bars? Being ill is better than putting this garbage in your mouth.",-1.0,1,2020-12-12,0,0,cauliflower,US,en,www.twitter.com/faoisejdfo/oijsd.html
889,B0041QIHC2,A2KHRJZDOQUK4Y,Andrew C,1326153600,"My brother bought me a pound of this coffee for Christmas.  He told me that ""weaver"" was the original roaster for Pete's coffee, he eventually split off and started his own roaster.  Well let me tell you the stuff is delicious!  I've never been married to a brand of coffee, usually would buy the Starbucks 2.5 lb bag at Costco, or whatever looked good at Trader Joes, but Weavers is in a class of it's own.  I'm subscribing to guarantee I can have this stuff delivered to me regularly.  TRY IT!!",1.0,1,2020-12-12,0,0,cauliflower,US,en,www.twitter.com/faoisejdfo/oijsd.html
890,B0041QIHC2,AK09TO4RIP6IR,Kristen Alexander,1284681600,"This is the best coffee we've ever had. A light taste but very full bodied. I was very pleased with the packaging, having it resealable keeps it stay fresher much longer and unlike other brands this construction stays intact. I must say you wont be displeased with your purchase, this is a must buy!",1.0,0,2020-12-12,0,0,cauliflower,US,en,www.twitter.com/faoisejdfo/oijsd.html
891,B0041QIHC2,A3L9WUD9W8TAFT,Julie Sisk,1284595200,This is the best coffee we've ever had.  I run The American Pavilion in Cannes and Weaver's was by far and  away our most popular coffee sponsor!  Hundreds of people come to The Pavilion every day looking for American coffee and they were not disappointed.  We did a booming business this year!  Buy it!  You'll be so happy you did!  Julie,1.0,1,2020-12-12,0,0,cauliflower,US,en,www.twitter.com/faoisejdfo/oijsd.html
892,B001ELL9XG,A2W9I628I6SE1U,"Kort ""Art, Music, Book & Movie Enthusiast""",1288310400,"For those looking for a more exotic tea drinking experience and who like white Jasmine tea, Numi's Flower Jewel is worth a look. About the size of a gum-ball, these jewels slowly open in water to form a flower shape around the central amaranth flower. They are meant to be decorative so glass teapot is a must when preparing this tea.<br /><br />Decorative does not mean tasteless. As a white tea, the flavor is mild, but rich and soothing. The jasmine is wonderful but does not overpower the tea. I have had stronger jasmine teas, but this one is quite balanced and tasty. I used a small glass pot when preparing it and was able to get more than 7 yummy infusions out of the jewel before the flavor and scent began to fade. The white tea tips are plentiful and of a high quality and don't get bitter if seeped for long periods.<br /><br />I must deduct some points though for the high price to tea ratio and the fragility of the flower jewels. Pouring hot water directly on them can cause pieces to fall of and after the 3rd or 4th infusion more of the flower starts to fall apart, though to be fair the main flower shape remains fairly intact. Some even come out of the box starting to missing the central flower or bits of leaf. Better packaging might solve this.<br /><br />If you want a tea experience that looks as good as it tastes and smells, or are entertaining and want a conversation piece, then Numi Tea Flower Jewel should be on your short list.",1.0,1,2020-12-12,0,0,cauliflower,US,en,www.twitter.com/faoisejdfo/oijsd.html
893,B001ELL9XG,AOQT2JCYZ1UWP,C. Murphy,1201392000,"The first ball worked pretty well, it just looked a little beaten up.  Since then, ~half of these have fallen to pieces in hot water (all of them do after sitting for a bit).  If you don't mind the rate of failure, the tea itself is pretty good and fairly tolerant of being steeped for a long time (especially considering that it is white tea).",1.0,0,2020-12-12,0,0,cauliflower,US,en,www.twitter.com/faoisejdfo/oijsd.html
894,B001ELL9XG,A2U4N0SDPQQ884,Cecilia,1198886400,"Numi has a winner here with this tea! My husband, son and I often share this wonderful tea after dinner. It is very pleasant and the reason they love it, it does not turn bitter after longer steeping, like other teas do!",1.0,0,2020-12-12,0,0,cauliflower,US,en,www.twitter.com/faoisejdfo/oijsd.html
895,B002DXZI40,AYZZSRYAIXNOS,"I Heart Amazon ""I heart Shopping""",1296432000,"The product is all that it says it is which is why I gave it 5 stars.  However, I do have issues with the product, namely, me and my family members can't take the smell.  The taste is horrible so I put it in a lotion cream and rubbed it on my skin.  This was a few weeks ago and though I've since changed my sheets, the scent is still in my bed.  Ultimately, I stopped using it because it made me smell in a way I did not like.  It smells like an Indian spice and while it didn't work for me, scent-wise, it may work fine with someone else.",1.0,0,2020-12-12,0,0,cauliflower,US,en,www.twitter.com/faoisejdfo/oijsd.html
