,ProductId,UserId,ProfileName,Time,Text,Sentiment,Helpfulness,date,flag,sarcasm,Product,country,lang,url
440,B000G6RYNE,A35JPD8Q492FJC,Firefly,1304640000,"For me, Kettle is the best brand on the market. They really know how to turn the humble potato into something fit for the gods! I didn't think anything could top their salt and pepper chips, but these are my new favorite. The flavors are pure and real. They go great with just about everything and are highly addictive! I hope they come out with a low fat version; their low fat chips are excellent but they need more flavors.",1.0,0,2020-12-12,0,0,cauliflower,US,en,www.twitter.com/faoisejdfo/oijsd.html
441,B000G6RYNE,A391CLP4UMXJQG,Dane King,1300924800,Salt and vinegar chips are definitely my favorite type of any potato chip. These ones made by Kettle were very tasty and I enjoyed them thoroughly. I just wish there was a more healthy option with the same great taste.,1.0,0,2020-12-12,0,0,cauliflower,US,en,www.twitter.com/faoisejdfo/oijsd.html
442,B000G6RYNE,AYB4ELCS5AM8P,"John B. Goode ""JBG""",1300579200,"What I like about them:<br />1) Very thick chips.<br />2) No trans fat and all natural, according to the info on the bag.<br />3) Flavor, but that's a subjective thing.<br />4) 2oz bags, which keep you from eating too much at one time. Just set a limit of 1 bag.<br /><br />Cons:<br />As another reviewer said, there's a lot of oil in them chips. What I do is place a paper napkin on a plate and pour the chips on them. Wait a few mins before eating and the napkin will soak some of the oil off. It seems gross that there is so much oil on the chip that a napkin will soak it off, but it's true! And at least this way, you'll get rid of some of the oil.",1.0,1,2020-12-12,0,0,cauliflower,US,en,www.twitter.com/faoisejdfo/oijsd.html
443,B000G6RYNE,A2GOE7ITDGYVE,Lee Brownell,1297900800,"These are so tangy it prevents me from eating too many, a handful or two does the trick. Very crisp and savory.",1.0,0,2020-12-12,0,0,cauliflower,US,en,www.twitter.com/faoisejdfo/oijsd.html
444,B000G6RYNE,A19G8B2QYETD7W,NyahNyah,1297555200,"I usually love Kettle Chips, and love salt & vinegar, but these chips were way too vinegary for me! They do have the typical kettle chip crunch, but are too aggressively flavored for my taste.",1.0,0,2020-12-12,0,0,cauliflower,US,en,www.twitter.com/faoisejdfo/oijsd.html
445,B000G6RYNE,A3PZ4AXTY9J1DZ,Jason Ralsky,1295913600,"I have always been a fan of Kettle chips.  When you open a bag of Kettle chips you know you are going to get quality.  These chips are no exception and live up to the name printed on the package.<br /><br />The New York Cheddar chips  have a very subtle flavor to them.  You can taste the cheddar in them; but it doesn't smack you in the face like supermarket brand chips might.  The taste lingers as well which is a definite plus!<br /><br />Another aspect about these Kettle chips is the fact every chip is nice and crisp, that crunch in your mouth.  On top of that there are no burnt chips in any of the bags I have had since the purchase.  The only negative I might have is that the flavoring of the chips is uneven.  Some chips might pack a nice cheddar punch while another might taste rather plain.  This isn't a big flaw as it happens when getting seasoned and doesn't ruin the bag at all.<br /><br />Overall the quality of the chips is fantastic.  The flavor is great and you wont' be disappointed , especially if you are a cheddar lover!",1.0,0,2020-12-12,0,0,cauliflower,US,en,www.twitter.com/faoisejdfo/oijsd.html
446,B000G6RYNE,ACFPHOYVB71V4,karob,1292630400,Tried many varieties of BBQ chips and hands down these are the BEST on the market! These R not too salty or greasy. Great crispy crunch. Plenty of good BBQ flavor with a hint of sweetness that all other brands fall short of. Every bag (after bag) is just as mouth wateringly delicious as the 1st!!,1.0,0,2020-12-12,0,0,cauliflower,US,en,www.twitter.com/faoisejdfo/oijsd.html
447,B000G6RYNE,A1H80WDFOR94Q5,Injured Panda,1290556800,"Kettle chis are the best ever! These used to be my favorite flavor until I tried their Salt and Pepper kind but I'm sure this is just a personal preference.<br /><br />Crunchy, real potato chips!",1.0,0,2020-12-12,0,0,cauliflower,US,en,www.twitter.com/faoisejdfo/oijsd.html
448,B000G6RYNE,A3Q5YZNYGGUP8W,cppme,1290297600,"These chips have the right amount of crunch and I enjoy the taste. Chips are consistent and have a fairly even distribution of seasoning. I like the 2-oz size bags, just the right amount of chips.",1.0,0,2020-12-12,0,0,cauliflower,US,en,www.twitter.com/faoisejdfo/oijsd.html
449,B000G6RYNE,AKRLMISQPL8QW,B. Sanders,1289174400,"I subscribed to these - one case every three months. That comes out to about $5 a month for the convenience of having my favorite chips handy whenever I want. Because it seems Frito-Lay has managed to crowd out every other chip vendor from pretty much all my local stores this is the best way to ensure a steady supply of the items I want rather than the items Frito-Lay wants me to have. The two ounce bags are larger than you might be used to buying at the Subway (for example) which I find works very well - they're large enough to be a good snack on their own, or you can even share a single bag over lunch. The size is perfect for ensuring these fantastically crunchy chips are always fresh - no chip clip needed!<br /><br />The only problem? I subscribed to four cases a year and having these yummy chips always in the pantry makes it really easy to increase ones Kettle chip consumption. Definitely have to hide the case from the kids!",1.0,0,2020-12-12,0,0,cauliflower,US,en,www.twitter.com/faoisejdfo/oijsd.html
450,B000G6RYNE,A2MUGFV2TDQ47K,"Lynrie ""Oh HELL no""",1288915200,"OK,I did read the reviews which ranged from splendid to awful. I took the plunge as I do like salty, and tangy flavors. No, I had never had these before I took the leap and ordered a case at a super price. They arrived quickly and in great shape with the sell by date  FEB 2011. Umm, I'm in the middle on these chips, they are OK but not something I can't live without. I love the crunch, the color, NO TRANS FAT. They are a little too vinegary for my taste, which is a lot coming from a kid that grew up eating pickled hard-boiled eggs and pickled pigs feet.<br /><br />I haven't tried them with a deli sandwich and a cold mug of beer which might improve the experience :)",1.0,1,2020-12-12,0,0,cauliflower,US,en,www.twitter.com/faoisejdfo/oijsd.html
451,B000G6RYNE,A1465JH39KR5O5,persia,1287360000,"This was the best deal ever. The delivery was fast, the chips are delicious and very fresh.  Love it:)",1.0,0,2020-12-12,0,0,cauliflower,US,en,www.twitter.com/faoisejdfo/oijsd.html
452,B000G6RYNE,A1L17QW3R7A519,The Boom,1281571200,My husband and I LOVE these chips! Personally I think the flavor is perfect. Try them for yourself!,1.0,0,2020-12-12,0,0,cauliflower,US,en,www.twitter.com/faoisejdfo/oijsd.html
453,B000G6RYNE,AOSFLVLMAG0N5,"Gloria E. Clements ""thistle809""",1266710400,"The barbeque flavor of these chips is really perfect! Just spicy enough, a hint of sweetness, just a little smokey. The chips themselves are extra crunchy and just thick enough to be substantial, but not hard. This makes for a wonderful snack or a great accompaniment for burgers, hot dogs or brats, chicken or just about any casual entree.",1.0,0,2020-12-12,0,0,cauliflower,US,en,www.twitter.com/faoisejdfo/oijsd.html
454,B000G6RYNE,A2H2Q5RW1K56AI,a Thai living in MN,1263945600,"I was hesitant to buy this at my local grocery store, Lunds, but they were on sale, so I bought a bag.  I've found that going beyond the simply-flavored chips, like cheddar or vinegar, usually results in disappointment.  Tried the Thai or asian-inspired chips by Target, Archer Farms, and they were awful.  These Kettle Spicy Thai chips are just awesome...so much so, that I'm considering buying them in bulk from Amazon.  The taste is complicated and stimulates different parts of the palate.  The taste sensations prevalent in real Thai food is baked into this chip...sweet, salty, spicy.  Was sour in there too?  I don't know, but this is a well-made well-balanced chip that is addicting.",-1.0,0,2020-12-12,0,0,cauliflower,US,en,www.twitter.com/faoisejdfo/oijsd.html
455,B000G6RYNE,A13VD7TJDWVOEC,Deborah E. Bumpus,1258329600,"As a professional potato chip muncher, I see these as thee very BEST on the market. Rich taste and flavor!! Almost impossible not to finish the entire bag.The true meaning of decadence!",1.0,0,2020-12-12,0,0,cauliflower,US,en,www.twitter.com/faoisejdfo/oijsd.html
456,B000G6RYNE,AKKQKYX8ODUAF,"Jordan B. Sanders ""Vortigern Trygil""",1258070400,"These are hands-down the absolute best Salt & Vinegar chips you can buy.  They have a great, strong flavor that has left me addicted.  These are certainly my favorite chips.  I highly recommend trying them!",1.0,0,2020-12-12,0,0,cauliflower,US,en,www.twitter.com/faoisejdfo/oijsd.html
457,B000G6RYNE,A3RB0YBBYGXBYE,"Matt C. ""Mattman""",1256083200,"Oh, I love these chips! And they're so hard to find where I am, and when I do find them, they're usually $1-2 more per bag for less. Great that these are so cheap here at Amazon.",1.0,0,2020-12-12,0,0,cauliflower,US,en,www.twitter.com/faoisejdfo/oijsd.html
458,B000G6RYNE,A3492ZW10B65ON,"P. Young ""Sugahplumm""",1250640000,"I LOVE these chips!  It is a little weird to review potato chips.  But these chips are great. The crunch is just right, plus they have just the right amount of salt. Not to salty not too bland. They are a little oily but that's ok. The best thing is the 2 oz package. When I buy a larger bag it's harder to resist eating them all.  This 2 oz package allows for a little ""portion control"". Be sure to use your scissors to open, 'cause these chips are packaged for freshness and don't open easily. Enjoy!",1.0,0,2020-12-12,0,0,cauliflower,US,en,www.twitter.com/faoisejdfo/oijsd.html
459,B000G6RYNE,A2ZEFDVX4X5TPX,"Thomas A. Roberts ""tomrgalvtx""",1249430400,"In the past couple years I have eaten and reviewed several kinds and styles of chips,  from the best I've ever had to big disappointments.  If you have eaten the LantChips varieties, there is no way that they are not the best as a group; the Kettle chips are rightly salted and I was so irritated by some Pringles products.  Kettle has good flavor but the small size and overwhelming oiliness takes away from the flavors.  All in all, its good to have choice--Amazon does not stock the LantChips all the time so there are some days that there is no choice.",1.0,0,2020-12-12,0,0,cauliflower,US,en,www.twitter.com/faoisejdfo/oijsd.html
460,B000G6RYNE,A2MMTWKCJET6S,T. judy,1245110400,"these chips are good, and bad, and create moral dilemmas constantly. If wou are strong at will, or having a large BBQ go for it, but as for me, i was in the habit of bringing a new bag to work every three days, had to put in a lot of time on the treadmill to make up for it. BEWARE",1.0,1,2020-12-12,0,0,cauliflower,US,en,www.twitter.com/faoisejdfo/oijsd.html
461,B000G6RYNE,A3RMGIKUWGPZOK,Jean Visnefski,1245024000,"Kettle Chips flavors can be hit or miss.  Some of their flavors are terrible.  But this is very simple and delicious.  Probably one of their best flavors.<br /><br />Pros: Thick, crunchy potato chips with light salt that doesn't compromise on taste, eco-friendly business that isn't just giving us lip service<br /><br />Cons: The occasional burnt chip and the bag is a pain to open.  They have a tab that you can pull down but most of the time I end up tearing down the entire side of the bag.  Use scissors instead.",1.0,0,2020-12-12,0,0,cauliflower,US,en,www.twitter.com/faoisejdfo/oijsd.html
462,B000G6RYNE,A1E2Y40TTPL8YK,EJH,1244678400,"We bought these chips at a little sandwich shop in Sonoma while we were on vacation. I wasn't sure what to expect by the package, and at first bite I didn't know what to think...and then all of the flavors hit!<br />Yum! They are a bit spicy, but nothing overpowering. Just lots of crunchy, sweet, spicy goodness. They aren't sold everywhere though, I'm still trying to find them somewhere close to where I live.",1.0,0,2020-12-12,0,0,cauliflower,US,en,www.twitter.com/faoisejdfo/oijsd.html
463,B000G6RYNE,A56JFSLUCHI4J,"Chi ""Who loves to find bargains and lives a g...",1237334400,"I have to admit that those chips are so good that they are highly addictive. I can't stop eating them!!! It's crunchy and seasoned at the right amount of flavor and salt. Just perfect!!! Believe me, some chips are so salty, I can't finish a small bag. But this one... I just keep on eating!",1.0,0,2020-12-12,0,0,cauliflower,US,en,www.twitter.com/faoisejdfo/oijsd.html
464,B000G6RYNE,A1DW1FK1H3F2TM,EuReka,1231977600,These are some of the best chips that I have ever had... They sure beat anything else out there and are even cooked in a way that is better for you than most other name brands. They are tangy and crisp and satisfy any craving at the time! These will be the only chips that I buy from now on and I thank amazon for letting me buy them online in bulk and save some money at the same time!,1.0,0,2020-12-12,0,0,cauliflower,US,en,www.twitter.com/faoisejdfo/oijsd.html
465,B000G6RYNE,A3PJZ8TU8FDQ1K,Jared Castle,1231718400,"I'm addicted to salty and tangy flavors, so when I opened my first bag of Sea Salt & Vinegar Kettle Brand chips I knew I had a perfect complement to my vegetable trays of cucumber, carrot, celery and cherry tomatoes. Skip the dip; balance the tangy chips by alternating bites of raw vegetable.<br /><br />As an Oregonian, I'm proud to share these delectable snacks with friends, especially those living outside our state and who haven't experienced gourmet chips. I tell them Kettle Brand does for potato chips what microbrews did for beer.<br /><br />Kettle Brand potato chips are unmistakable--a light gold color, rich flavor and amazing crunch. Kettle Brand chips are also a healthier snacking option than the major chip brands. Kettle Brand chips don't have trans fats, MSG or artificial flavors and colorings. The company also has a line of organic potato chips and all of their products are certified Kosher.<br /><br />I also recommend <a href=""http://www.amazon.com/gp/product/B000G6MBV4"">Kettle Chips Honey Dijon</a> and <a href=""http://www.amazon.com/gp/product/B000G6Q4GM"">Kettle Chips Spicy Thai</a>.<br /><br />Annette Solomon, a reporter for the Salem Statesman Journal recently noted that a glass of wine goes nicely with these chips. Solomon wrote, ""...you could be missing out on a wonderful pairing. These chips are spicy, so you would want to select a semi-sweet white wine. Also, a moderate amount of acid will subdue the strong flavors of ginger, lime, garlic and cilantro without over-powering them. Classically, a German-style Riesling fits these parameters perfectly.""",1.0,0,2020-12-12,0,0,cauliflower,US,en,www.twitter.com/faoisejdfo/oijsd.html
466,B000G6RYNE,A3PJZ8TU8FDQ1K,Jared Castle,1231718400,"These Honey Dijon chips bring a terrific balance of salty, tangy, sweet and crunchy. Other brands I've tried use too much mustard flavor, which overpowers the Honey Dijon pairing.<br /><br />These chips make a great side dish on a BBQ plate with baked beans, coleslaw or potato salad and grilled meat. Naturally, they also go down great with beer.<br /><br />As an Oregonian, I'm proud to share these delectable snacks with friends, especially those living outside our state and who haven't experienced gourmet chips. I tell them Kettle Brand does for potato chips what microbrews did for beer.<br /><br />Kettle Brand potato chips are unmistakable--a light gold color, rich flavor and amazing crunch. Kettle Brand chips are also a healthier snacking option than the major chip brands. Kettle Brand chips don't have trans fats, MSG or artificial flavors and colorings. The company also has a line of organic potato chips and all of their products are certified Kosher.<br /><br />I also recommend these other Kettle Chips flavors: <a href=""http://www.amazon.com/gp/product/B000G6MBUA"">Kettle Chips Sea Salt & Vinegar</a> and <a href=""http://www.amazon.com/gp/product/B000G6Q4GM"">Kettle Chips Spicy Thai</a>.<br /><br />Annette Solomon, a reporter for the Salem Statesman Journal recently noted that a glass of wine goes nicely with these chips. Solomon wrote, ""...you could be missing out on a wonderful pairing. These chips are spicy, so you would want to select a semi-sweet white wine. Also, a moderate amount of acid will subdue the strong flavors of ginger, lime, garlic and cilantro without over-powering them. Classically, a German-style Riesling fits these parameters perfectly.""",1.0,0,2020-12-12,0,0,cauliflower,US,en,www.twitter.com/faoisejdfo/oijsd.html
467,B000G6RYNE,AU3VZDTQH0J4M,C. Charles,1231545600,These chips remind me of a long obsolete brand of chips we could get in middle school. They are by far the tastiest chips I've had and it's impossible to walk past the aisle without picking up the trademark blue bag and then putting the bag clip on the bag!,-1.0,0,2020-12-12,0,0,cauliflower,US,en,www.twitter.com/faoisejdfo/oijsd.html
468,B000G6RYNE,A3B0HXAUWCLSZO,MisterStorm,1221436800,"These are by far my favorite chips, they are extremely crunchy (similar to other Kettle style chips), but it's the extreme Vinegar flavor that differentiates these from lesser fried potato snacks.  I've tried several other brands of Salt and Vinegar and none of them come close.",1.0,0,2020-12-12,0,0,cauliflower,US,en,www.twitter.com/faoisejdfo/oijsd.html
469,B000G6RYNE,A17UR3NRLARXCH,"W. Muckelroy ""Chawk68""",1221091200,"They are good but need more cheese and wish they were krinkle cut. I much prefer the salt & pepper just for the krinkle cut - they have a better texture. All around this brand is much better than Frito-Lay and a good price on Amazon when you get free shipping. These are similar to Tim's or Zack's chips in that they are very crispy.<br /><br />On a side note, these are the hardest bags to open by hand. I have to use a knife or scissors everytime.",1.0,0,2020-12-12,0,0,cauliflower,US,en,www.twitter.com/faoisejdfo/oijsd.html
470,B000G6RYNE,A31N6KB160O508,Fran W.,1219795200,It took a while to get used to these chips but they are pretty good and more healthy for you. They sure were eaten all up by my family and friends.,1.0,0,2020-12-12,0,0,cauliflower,US,en,www.twitter.com/faoisejdfo/oijsd.html
471,B000G6RYNE,A339FKUBFG0VLX,the Poodle,1217376000,"These are delicious.  The 2 oz bags are a bit big for school lunches, definitely more than a serving.",1.0,0,2020-12-12,0,0,cauliflower,US,en,www.twitter.com/faoisejdfo/oijsd.html
472,B000G6RYNE,A3MLESXA2VGWJC,CV,1217376000,"I recently tried this flavor/brand and was surprised at how delicious these chips are.  The best thing was that there were a lot of ""brown"" chips in the bsg (my favorite), so I bought some more through amazon and shared with family and friends.  I am a little disappointed that there are not, so far, very many brown chips in these bags, but the flavor is still very good.  I like them better than the yogurt and green onion flavor because they do not seem to be as salty, and the onion flavor is better.  If you haven't eaten Kettle chips before, I recommend that you try a bag before buying bulk.  They are thicker and crunchier than Lays but just as fresh out of the bag.",1.0,0,2020-12-12,0,0,cauliflower,US,en,www.twitter.com/faoisejdfo/oijsd.html
473,B000G6RYNE,A3UCO7B9HP42BG,Denise Graner,1217203200,"We are always pleased with Amazon's packaging. Chips are never crushed or broken, always fresh. We really liked this brand/flavor of chips. Very tasty!",1.0,0,2020-12-12,0,0,cauliflower,US,en,www.twitter.com/faoisejdfo/oijsd.html
474,B000G6RYNE,A1DOBB5XZ1KMZ5,"A. M. L. Hentz ""AnneMarie""",1217030400,"These chips are some of the best I've tasted. They are not filled with chemicals. You taste the tangy vinegar as well as the potato. Not greasy. Perfectly crispy. If you don't like salt and vinegar tanginess, don't even bother to try. These definitely have zip. I love them. My children and their friends love them. Even my 4 year old loves them!",1.0,0,2020-12-12,0,0,cauliflower,US,en,www.twitter.com/faoisejdfo/oijsd.html
475,B000G6RYNE,A3I96LKK3S15D0,"R. Wheeler ""Pryd""",1215993600,"These chips were a great deal.  Kettle was having a special deal for the case of chips.  They are hard to find in Vegas and are my favorite flavor. Shipping was very fast, sooner than expected.",1.0,0,2020-12-12,0,0,cauliflower,US,en,www.twitter.com/faoisejdfo/oijsd.html
476,B000G6RYNE,A2LS9RBSI8SDZF,Ashish Shah,1215475200,fantastic!you can not beat this taste and you can not resist to it only one if you are spice lover,1.0,0,2020-12-12,0,0,cauliflower,US,en,www.twitter.com/faoisejdfo/oijsd.html
477,B000G6RYNE,A324FVIOYCWNSB,"Eric BVD ""Eric""",1215302400,Eat at your own risk.  Once I would open a bag I could not stop.  Good and salty.,1.0,0,2020-12-12,0,0,cauliflower,US,en,www.twitter.com/faoisejdfo/oijsd.html
478,B000G6RYNE,A1RRHET1QIP1YK,Daniel Hill,1215302400,"I don't eat many chips, but these I love. Great buy and arrived quick and packed great. Expiration date is a ways away, so I have awhile to enjoy them Great natural potato flavor. I love brown russet, hardy flavor and these fit that description to a tee.",1.0,0,2020-12-12,0,0,cauliflower,US,en,www.twitter.com/faoisejdfo/oijsd.html
479,B000G6RYNE,A12OF4IM7A8YS,"Norman Tang ""Amazon Norman""",1215216000,I simply fell in love with these chips and refused to share them with my friends.  :))  My experience with a lot of cheese-favored chips has been too salty and a little over the greasy side.  But these NY Cheddar from Kettle really changed my mind.  Thanks to Amazon for great discounts and I don't have to buy them from the store anymore.,1.0,0,2020-12-12,0,0,cauliflower,US,en,www.twitter.com/faoisejdfo/oijsd.html
480,B000G6RYNE,AUHS7PQNAHNDI,"C. Graube ""pup friend""",1215216000,Bought this box of chips as a Father's Day gift because Dad loves them.  They are very yummy and more substantial than regular chips.,0.0,0,2020-12-12,0,0,cauliflower,US,en,www.twitter.com/faoisejdfo/oijsd.html
481,B000G6RYNE,A26ONAQEIUEMV4,"Dolores Swan ""Swannie""",1215129600,"These chips are quite tasty and the price is right.  Packaged very well, would buy again.",1.0,0,2020-12-12,0,0,cauliflower,US,en,www.twitter.com/faoisejdfo/oijsd.html
482,B000G6RYNE,AOHRHPJP38LLT,"S. Samoranos ""Inspired cook""",1214784000,I like Kettle chips but was really disappointed with this order because they were over cooked.  I bought a bigger sized bag from Costco and the chips were all cooked perfectly. So I don't know why these were different.<br />Will never buy these chips from here again.,1.0,0,2020-12-12,0,0,cauliflower,US,en,www.twitter.com/faoisejdfo/oijsd.html
483,B000G6RYNE,A1AXXMJQ3NDIFK,Barbara A. Puckett,1214697600,For some reason Amazon would not ship these to Alaska!..so I sent them to my grandchildren who got to enjoy them.  They are very good chips! Amazon should rethink the shipping to Alaska thing.  I would order groceries online.,1.0,0,2020-12-12,0,0,cauliflower,US,en,www.twitter.com/faoisejdfo/oijsd.html
484,B000G6RYNE,A31N6KB160O508,Fran W.,1214006400,"My husband likes these a lot. They are a bit different to get used to as they are less greasy and salty in taste than the usual chips you buy. They are more browner than I would like to see and the chips are pretty sturdy in texture. Not bad, though. Just takes getting used to eating chips better for your health. They do have about 1/2 the calories in fat, however.",1.0,0,2020-12-12,0,0,cauliflower,US,en,www.twitter.com/faoisejdfo/oijsd.html
485,B000G6RYNE,A31N6KB160O508,Fran W.,1214006400,"Just got this order and it is ok. A bit light on the cheddar flavoring and herb taste eludes me, if it is there.",1.0,0,2020-12-12,0,0,cauliflower,US,en,www.twitter.com/faoisejdfo/oijsd.html
486,B000G6RYNE,A1WQ3UGXPT15VI,"JavaJewel ""It's all  water under the bridge...""",1213920000,"I really love Kettle brand chips, but these are rather disappointing. There is very little sour cream or onion flavor.",-1.0,0,2020-12-12,0,0,cauliflower,US,en,www.twitter.com/faoisejdfo/oijsd.html
487,B000G6RYNE,A1B05INWIDZ74O,M. A. Ramos,1213142400,"I took one and said good Russet potato chip but I found that the flavoring was subtle for my taste, a bit oily and overcooked. It may be because I am use to eating their great tasting <a href=""http://www.amazon.com/gp/product/B000G6Q4GM"">Kettle Chips Spicy Thai, 2-Ounce Bags (Pack of 24)</a>. Or perhaps because all the chips in the bags I received were overcooked and that overpowered the seasoning. It is obvious the chips are flavored, but if I did not read the bag I would never have thought it had Cheddar flavor. And I love New York Cheddar. The flavoring included Parmesan, Cheddar, Blue Cheese, garlic and other spices. A good chip even when overcooked, but I do not plan to buy them again.",1.0,0,2020-12-12,0,0,cauliflower,US,en,www.twitter.com/faoisejdfo/oijsd.html
488,B000G6RYNE,A1B05INWIDZ74O,M. A. Ramos,1212451200,"I took one and said good Russet potato chip but where is the flavoring? Then all of a sudden, within seconds, it spread to my senses and my taste buds were happy. As close to Thai food as a potato chip can get.  These chips are spicy enough to satisfy that craving for spice and a hint of sweetness that makes them habit forming. The flavoring included garlic, ginger, jalapeno, cilantro and other spices, and it just felt great to eat these. I will buy these again. These were a treat.",1.0,0,2020-12-12,0,0,cauliflower,US,en,www.twitter.com/faoisejdfo/oijsd.html
