,ProductId,UserId,ProfileName,Time,Text,Sentiment,Helpfulness,date,flag,sarcasm,Product,country,lang,url
716,B000G6MBX2,A2GS0QUCV2KVMP,Stephanie J. Myers,1209686400,I love these chips and ordered them after I had some in Florida.  My case of chips came without any packing inside.  All bags in a box with no cushioning at all.  Needless to say most of the chips were broken and I would not order them again.  A great item but if they can't package to aid in minimal chip breakage then one is wasting their money.,1.0,0,2020-12-12,0,0,cauliflower,US,en,www.twitter.com/faoisejdfo/oijsd.html
717,B000G6MBX2,A1D0P49A1MQO1O,"JSY9951 ""JSY9951""",1209340800,"I received this chips in a gift basket and absolutely loved them. I searched high and low, but was unable to find them until I saw them here. I immediately ordered a case. These chips are light, crispy, flavorful, and good for you. I love them with dip, in chili, or just plain. Once you try them, you'll be hooked!",1.0,0,2020-12-12,0,0,cauliflower,US,en,www.twitter.com/faoisejdfo/oijsd.html
718,B000G6MBX2,A3J6N95DIJTPVH,"B. P. Mayeux ""bpmayeux""",1203811200,"These chips are truly amazing. They have it all. They're light, crisp, great tasting, nice texture, AND they're all natural... AND low in fat and sodium! Need I say more? I recently bought a bag of them at a regular grocery store, and couldn't belive my taste buds. That's why I excited why I saw them here on Amazon, and decided to buy a case!",1.0,0,2020-12-12,0,0,cauliflower,US,en,www.twitter.com/faoisejdfo/oijsd.html
719,B000G6MBX2,A3MALNCOVF5COP,Overseas Mom,1203206400,"These are the most fantastic chips I've ever had!  I could eat the whole bag myself!  They're made with lots of whole grain and beans, and make a complete protein, so I have no qualms about feeding them to my kids as snacks.  They are great!  The only problem I have with them:  The bag is too small!!!  We need a bigger bag!! :)",1.0,0,2020-12-12,0,0,cauliflower,US,en,www.twitter.com/faoisejdfo/oijsd.html
720,B000G6MBX2,A1ABDQ02BCIGYQ,HM,1173830400,"I did not like these potatoe chips. It's hot, and sweet, with an overwhelming taste of garlic. It's also a bit salty.",1.0,0,2020-12-12,0,0,cauliflower,US,en,www.twitter.com/faoisejdfo/oijsd.html
721,B000G6MBX2,A1KBNKFKAWYV7L,Charles R. Bock,1186704000,They did a very good job with shipping the order quickly....Nothing like Ace Hardware who took a week to ship,1.0,0,2020-12-12,0,0,cauliflower,US,en,www.twitter.com/faoisejdfo/oijsd.html
722,B000G6MBX2,ARLTWKV2AUJ2F,koboilila,1237939200,"Long story short - these are very tasty. We have purchased a number of flavors from this brand, this is my favorite.<br /><br />BUT... as noted by another reviewer - these contain MSG in the form of ""Yeast Extract"".<br /><br />It has become a popular means of hiding MSG lately by calling it different things, as a person who now finds himself having to use more caution in what I consume I find the whole process of hiding in plain site very bothersome.<br /><br />Also, the bag is not very large, but half of it is air. This may well help in shipping, but when paying a premium price for 'organic' it just seems more deceptive.",1.0,1,2020-12-12,0,0,cauliflower,US,en,www.twitter.com/faoisejdfo/oijsd.html
723,B001F33UPI,AGXEFR3PWFEM,Steph,1345939200,"Wonderful candy, hard to find.  I got a huge bag and put it in freezer.  It came shipped nicely in a sturdy box and heavy plastic. Just great!",1.0,0,2020-12-12,0,0,cauliflower,US,en,www.twitter.com/faoisejdfo/oijsd.html
724,B001F33UPI,ACPABFZ8DBLDG,Sonya Milliron,1322438400,I bought thi9s for my dad for a surprise birthday present because he could not find them any where else!!,0.0,0,2020-12-12,0,0,cauliflower,US,en,www.twitter.com/faoisejdfo/oijsd.html
725,B008BEGP9W,A2L0EIYNODCZ9U,good dog,1346371200,"So surprised to find the Taiwan-shaped pineapple cakes, they are so cute!<br />I've never found any pineapple cake like this at our local Asian supermarkets, so I ordered some from here. These lovely pastries made our Dragon Boat Festival party much more fun. My friends and I think it is a good idea to  order them again for our Mid-Autumn Festival party.",1.0,0,2020-12-12,0,0,cauliflower,US,en,www.twitter.com/faoisejdfo/oijsd.html
726,B008BEGP9W,A1MJ0MF2OFIU4D,Chris,1340496000,"I really like the pineapple shortcakes sold here. Unlike some of the mass-production pineapple shortcakes that use artificial flavoring, Tasselfield's pineapple shortcakes use real pineapples and it makes the whole world difference. You can even taste the fibers from pineapple.<br /><br />I opted for the traditional pineapple this time. I will be interested in trying out the Longan or mango variety next time.",-1.0,0,2020-12-12,0,0,cauliflower,US,en,www.twitter.com/faoisejdfo/oijsd.html
727,B002U56JXK,A1PIDGL665V5QP,Rod Jonse,1303862400,"I purchased this 24 pack of Big Ass soda and only got 23. Immediately I was all like ""Oh man, this is gonna suck!"". Regardless of the quantity error though, it sure kicked some red.<br /><br />Everyone in my town absolutely loves it. I highly recommend along with other soda, Voltages.<br /><br />-Malcom",1.0,1,2020-12-12,0,0,cauliflower,US,en,www.twitter.com/faoisejdfo/oijsd.html
728,B002U56JXK,ASC04R0BT3TO4,"the BURNiNATOR ""raggle fraggle""",1303862400,"Well being the big red fan that I am, I bought some of this. First of all let me tell you the price is amazing, I mean where else can you get this type of deal in Saudi Arabia. Everyone in village loved it, of course now they are wondering when the next shipment will get it.",1.0,1,2020-12-12,0,0,cauliflower,US,en,www.twitter.com/faoisejdfo/oijsd.html
729,B007P2PSKS,AFSFFRR7JMPZ8,Dissapointed,1348617600,"Expiration date 1-13. Smashed and. stale. edible, not real enjoyable for the price I paid, One of the best pretzel's I had when<br />i purchased them from Publix. They stopped carrying them, I must find another addiction.",1.0,0,2020-12-12,0,0,cauliflower,US,en,www.twitter.com/faoisejdfo/oijsd.html
730,B004A8QK98,A2QWGB918P1HU0,Runriverrun,1325894400,This cinnamon cake loaf has a wonderful natural flavor.  It's moist and tender and a great little sweet treat when you want something that isn't terribly bad for your diet.  It's delicious!,1.0,0,2020-12-12,0,0,cauliflower,US,en,www.twitter.com/faoisejdfo/oijsd.html
731,B004A8QK98,A2FZE965O64BXJ,Grandma LU,1342742400,"Unfortunately having ordered quite a few of these previously, I neglected to not look for the word: ""supreme"" in this offer and since I was then receiving free shipping had 4 delivered. We (that is my husband, guests and me)knew immediately that these were different from those previously enjoyed. BUT, currently Amazon featured the ""supreme"" babka and now I am awaiting to receive these. In the future, I will read more carefully.",1.0,1,2020-12-12,0,0,cauliflower,US,en,www.twitter.com/faoisejdfo/oijsd.html
732,B001HTKZ5S,ARQ2DJUU4XB1V,Cooking  Mama,1263686400,"I opened the can and immediately became concerned when I saw what looked like dried white crust, rather than fluffy frosting.  The package recommended stirring before use, so I gave that a try and under the crust was an indescribable gelatinous goo.  The best I can equate it to is a white version of the blue goop the mother serves for dinner in ""Better of Dead"" (no raisins in it though!).<br />I tried to stir it together and the end result was gelatinous goo with white crusties in it.  When lifting the knife to spread it long strings on goo trailed from my knife.<br />I opted for making my own frosting instead - very easy!  A little Sprectrum palm shortening, a lot of powdered sugar, a tiny splash of vanilla, a tiny bit of salt, and rice milk as needed for consistency, beat for 5 minutes, and I had the fluffy 'butter' cream frosting I thought I'd get from Cherrybrook.<br /><br />I wonder if our can was overheated in the store (whole foods) or something...<br />I've read positive reviews of their frosting mix, so maybe I'll try that next time.",1.0,1,2020-12-12,0,0,cauliflower,US,en,www.twitter.com/faoisejdfo/oijsd.html
733,B001HTKZ5S,A2AF5SS29LC4BB,"Andrea Zalesakova ""AZ""",1269993600,"Well, I opened it and it is grayish sticky mess. I'm so mad at myself for wasting my money, and not trying to make it from scratch at home. Which would probably end up better and cheaper. Oh well, live and learn!",-1.0,1,2020-12-12,0,0,cauliflower,US,en,www.twitter.com/faoisejdfo/oijsd.html
734,B001HTKZ5S,A3KJ6JZ8MWERPG,RnnrGrl,1264896000,"I love Cherrybrook Kitchen and have tried almost all of their products.  I was excited to try the Ready to Spread frosting, as I do not usually keep the needed ingredients on hand for their box frosting.  I am not a picky eater, especially if the item contains sugar... but this was horrible!  The consistency is absolutely nothing like regular canned frosting.  It is not light and fluffy.  It is very gooey.  I cannot even imagine trying to spread it on a cake - it would rip it to pieces because it is so thick and gooey.  I did not even try it on a cake, because the taste and texture were so off-putting.  Seriously, do not waste your money!",1.0,0,2020-12-12,0,0,cauliflower,US,en,www.twitter.com/faoisejdfo/oijsd.html
735,B001HTKZ5S,A1USXH72S0TD4B,Michelle M. White,1287100800,"This product was such a disappointment!  As all the other reviewers said, it's a gluey, sticky texture more akin to Elmer's Glue than to an edible food product.  The flavor was sickening sweet.  I actually thought that the frosting had spoiled.  It was that bad!  Save yourself the time and $$ (I paid $4.99) and make your own frosting or go with another brand.  Cherrybrook cake and cookie mixes are so good.  It's hard to believe they even sell this.",-1.0,1,2020-12-12,0,0,cauliflower,US,en,www.twitter.com/faoisejdfo/oijsd.html
736,B001HTKZ5S,A1ZE87EABE7FVQ,"ClaraP ""BookHooked""",1284249600,"I am glad I found this on the reduced rack for 99c. The taste was not bad but no way I could frost my cake. It stuck to the knife,ran down in strings,what a mess. I too thought I had gotten a bad batch.My GDs birthday cake looks like crap. Who would buy this mess. Horrible",-1.0,0,2020-12-12,0,0,cauliflower,US,en,www.twitter.com/faoisejdfo/oijsd.html
737,B001HTKZ5S,A2USOYPY0M1R6X,Colleen,1282608000,"I recently purchased this on sale at my local grocery store... now I know why it was on sale!<br /><br />This is not a fluffy, creamy white frosting you'd expect to find when opening the jar. Now, I wasn't expecting it to be just like Betty Crocker, but it was pretty bad. Like others said, it is a gluey/tacky mess that would completely ruin a cake if you tried to spread it on.  It reminds me of taffy that hasn't quite hit the right stage in the candy making process.  The taste isn't that great either, and it's sickeningly sweet (even for frosting).  The only thing it might be used for is a frosting for cinnamon buns?  I still don't think it would be the right consistency...",1.0,0,2020-12-12,0,0,cauliflower,US,en,www.twitter.com/faoisejdfo/oijsd.html
738,B001HTKZ5S,AOHGLP2W3B3I4,Scott Schrantz,1281312000,"I can honestly say this is the worst frosting we have ever bought. It's kind of generous to call it frosting, it has more the consistency of rubber cement. And since we were in a time crunch, we didn't have the luxury of going back out to the store for a different frosting, so we forged ahead and decorated a cake with it. Horrible experience, bad enough to put us off cake decorating forever. It spread about as easily as chewing gum, stuck to everything it came in contact with, and got crumbs of the cake mixed up in it. On top of all this, it didn't even taste good. By the time we were done decorating, we knew there was no way we could feed this mess to our family. So we ended up going to the store anyway to buy a pre-made cake. Our cake, which took twice as long to decorate because this stuff is so gooey, was used as a centerpiece. A really ugly centerpiece, that cracked and peeled as the frosting dried.",-1.0,0,2020-12-12,0,0,cauliflower,US,en,www.twitter.com/faoisejdfo/oijsd.html
739,B001BB3LW6,A388FLQFOEM0IO,Diana Solomon,1276732800,I work in college Financial Aid and keep a bowl of these on my desk for the students.  I used to buy them in the grocery store then learned I could get them for less online ($17 for 3lb bag) and thought that was a good deal - until I found this GREAT deal!,1.0,0,2020-12-12,0,0,cauliflower,US,en,www.twitter.com/faoisejdfo/oijsd.html
740,B001BB3LW6,A1ZS6CRXGZX4YE,R. Martin,1308182400,Well worth the money. I did the calculations on different bags and this dollar amount  is an excellent value. There are approx 2338 pops in the box. So far I've been through about half the box and have found about 3 without wrappers. That's pretty good considering. If you need 30lbs of dum-dums go for this product. Enjoy.,1.0,1,2020-12-12,0,0,cauliflower,US,en,www.twitter.com/faoisejdfo/oijsd.html
741,B005Y0DXBO,A21TGZU9EXJ272,mizztanya,1336435200,"This is pretty good canned meat. The sausage I used in dirty rice, the hamburger I used for taco salad, the chicken with wild rice, and the pork with stuffing. the turkey I gave to a neighbor because I don't eat it. The various meats are all pretty good quality and was enough for 3 large portions each can. There weren't large chunks of fat or gristle in any of the cans, which I've experienced plenty with some brands of canned meats. The proportion of liquids to meat was fair too, it's not one of those with a spoonful of meat and the rest is liquid either, though it does all need to be cooked and shrinks quite a bit due to high fat content in the meat. None of the meat was seasoned, at all. This is very helpful as the meat can be used with any flavoring. There is a mild ""spam""-like texture and taste to the meats(but way better than spam any day), almost a brine or something, that's why I heavily seasoned it. Don't plan on frying anything in the fat from these meats, it gave everything a slightly rancid, soury taste...no idea why! Due to the higher calories and higher price, I will only stock this as emergency food. I will buy more for that reason.",1.0,1,2020-12-12,0,0,cauliflower,US,en,www.twitter.com/faoisejdfo/oijsd.html
742,B001LO4ZWI,A1K7OUOZGT6EG3,"Zak Rudy ""muzak""",1328659200,"Bear with me while I do amazon's work for them and copy from the Lakewood website:<br />---------------------------------------<br />Nutrition Facts<br />32oz UPC 042608460503<br /><br />Serving Size 8 oz<br />Serving Size 240 ml<br />Amount Per Serving<br />Calories 125  Calories from Fat 25<br />% Daily Value*<br />Total Fat 3.5g  6%<br />Saturated Fat 0.5g  4%<br />Trans Fat 0g<br />Cholesterol 0mg  0%<br />Potassium 370mg  10%<br />Sodium 25mg  1%<br />Total Carbohydrate 28g  9%<br />Dietary Fiber 4g  16%<br />Sugars 21g<br />Protein 2g<br /><br />Omega 3 40mg, Omega 6 600mg, Omega 9 2400mg, Vitamin A 20%, Vitamin C 100%, Calcium 6%, Iron 8%, Vitamin E 6%, Vitamin B1 (Thiamin) 6%, Vitamin B2 (Riboflavin) 4%, Niacin 6%, Vitamin B6 8%, Folate 8%, Magnesium 8%, Zinc 2%, Phosphorous 4%, Vitamin K 15%,<br />*Percent Daily values are based on a 2,000 calorie diet<br /><br />Ingredients<br />Certified Organic Juice Blend (Organic Acai, Organic Apple, Organic Concord Grape, Organic Grape, Organic Pomegranate, Organic Blackberry, Organic Blueberry, Organic Red Tart Cherry, And Organic Acerola Cherry From Concentrate); Organic Goji Berry, Natural Fiber (Organic Guar, Xanthan, Carrageenan, Sodium Alginate And Organic Locust Bean), And Organic Rose Hip.<br /><br />Gluten FREE* Casein FREE GMO FREE*<br />100% Fruit Juices are Gluten-Free<br />---------------------------------------<br /><br />This is an excellent Lakewood juice- they call it juice but it's as thick as an Odwalla drink like a smoothie. With all that's in it, this is a very good value. Considering you can pay as much for any one of the ingredients in it. My personal use is to add this to kombucha, maximizing it's longevity that way, I've tried many but this one is the best for kombucha. They say an 8oz glass has 2 servings of fruit on the Lakewood website. It's quite tasty in that it's not too sweet, very thick textured even with the tiny bits of seed in it reminiscent of a banana smoothie. The ingredient list is somewhat confusing but note that only the Acerola Cherry is from concentrate, everything else is fresh pressed. Acai is very high on the ORAC scale of anti-oxidants, Rose Hips are also very high, everything else is in the mid to high range of fruit. Pomegranate has many beneficial properties beyond just anti-oxidants as well, it's a noteworthy fighter of heart disease and Alzheimer's type dementia. Considering the price of Goji berries I really like their inclusion in this drink, albeit at a lesser level.<br /><br />BTW: Amazon had only 1 day wait before shipping.",1.0,1,2020-12-12,0,0,cauliflower,US,en,www.twitter.com/faoisejdfo/oijsd.html
743,B001LO4ZWI,A2M687HYOW9JFW,dream factory,1334448000,"A watered down perversion of the acai berry.<br /><br />This juice comes on strong and harsh.  With tart aftertaste and no texture.<br /><br />That's because it is mostly apple juice, grape juice, pomegranate juice, blackberry juice, blueberry juice, and tart cherry juice.  Oh yeah there is some acai berry juice mixed into this concoction.<br /><br />You shall not find that distinctive  smooth chocolaty acai flavor here.  There is no milky mouth pleasing texture neither.  For that exotic unique acai experience try Zola or Samzon  brands.<br /><br />I'm not saying that this Lakewood juice product isn't nutritious.  That's not my point.  I'm saying that it's a juice blend that does not taste anything like the real acai juice.",1.0,0,2020-12-12,0,0,cauliflower,US,en,www.twitter.com/faoisejdfo/oijsd.html
744,B000QWXG9O,ANUUF3N6B9NTA,Tabitha,1348185600,"This product is made by Annie's Inc. in Berkely, CA--made in the USA.  The product maintains excellent organic integrity, and it is stored in 100% recycled paperboard packaging.<br /><br />The manufacturers also support family farms - use organic milk, butter, and yogurt.  The product takes approximately 10 min. to prepare.  The product contains dairy and wheat, and it has been exposed to equipment that also processes egg and soy products.<br /><br />The ingredients include organic whole wheat shell pasta, organic valley organic cheddar cheese (organic cultured pasteurized milk, salt, non-animal enzymes), organic whey, salt, and sodium phosphate.<br /><br />This is a mildly flavored whole wheat macaroni & cheese dinner.  This mac and cheese is a wonderful comfort food.  The pasta is firm, and it has an excellent flavor.<br /><br />There are no artificial flavors, synthetics colors, or preservatives.  The pasta was produced without antibiotics, synthetic hormones, or persistent pesticides.<br /><br />This pasta is simple to make and it has a wonderful texture.  There are 2.5 servings per box (2.5 oz).  Each serving contains 250 cal., 4.5 g fat, sat. 2 g fat, 10 mg cholest., 570 mg sodium, 43 g carb., 5 g fiber, 6 g sugars, 9 g protein.<br /><br />However, the cheese envelop is not exactly sufficient even when you add the butter, milk, or yogurt.  To add that wonderful rich smooth cheese flavor that accompanies mac and cheese, you will have to add your own organic cheese.<br /><br />The cheese packet falls flat on flavor and it does not contain a sufficient amount to coat the pasta.  I give this mac and cheese a 5/5 on packaging, 5/5 for maintain organic integrity, 5/5 on texture, and a 2/5 for flavor.",1.0,1,2020-12-12,0,0,cauliflower,US,en,www.twitter.com/faoisejdfo/oijsd.html
745,B000Y2EJHY,A7IFA2NZR7YV0,pmen123,1344902400,"If this flavor lasted longer than it does, I'd probably die of starvation for lack of wanting to take it out of my mouth.",0.0,1,2020-12-12,0,0,cauliflower,US,en,www.twitter.com/faoisejdfo/oijsd.html
746,B000Y2EJHY,A11V8XN8SUHPOV,"Marilyn Demaio ""mumsie""",1263945600,this gum is super sick.tatooes are killin.flavor is a spankin'.this brings back bomb diggity memories yo.peace out.,-1.0,1,2020-12-12,0,0,cauliflower,US,en,www.twitter.com/faoisejdfo/oijsd.html
747,B004WJAUBE,A2DYZJ8D7QD1KE,Debs,1327536000,"My husband and I were very disappointed in this coffee, very weak, watery cup of coffee. A definite waste of $13.00.",-1.0,0,2020-12-12,0,0,cauliflower,US,en,www.twitter.com/faoisejdfo/oijsd.html
748,B0035YE9CS,A3K0UVMET7SEWE,Electric Leaf,1283644800,"This is pretty good regular style soy sauce.  But it is not super-wonderful-better than any other good quality soy sauce you can buy in an Asian market.  The main value is as a unique gift.<br />  In the Japanese soy sauce world, there are 4 types: regular, mild (usukuchi), for raw fish (sashimi) and light colored.  Bluegrass soy sauce is regular style.  Compared to Kikoman (a good commercial brand that is widely available) Bluegrass starts saltier, is flat in the middle, then ends with a complex & interesting flavor.  Kikoman is less salty initially and has a round, full flavor in the middle.  Doesn't have the complex ending flavors.  For me, the initial saltiness of Bluegrass is a minus and Kikoman's full middle flavor is a plus.  I prefere Kikoman, especially for dipping sushi where the flavor is more direct.  But I lived in Japan for many years and am used to the standard Japanese flavor.  I haven't tried Bluegrass blended in other food as a background flavor, which is how soy sauce is usually used.<br />  Bluegrass is a perfectly good soy sauce.  Each brand has a different flavor and everyone has their favorite.  If you want a unique Kentucky gift for an Asian friend, this is different than the standard bottle of Bourbon or box of chocolate.",1.0,1,2020-12-12,0,0,cauliflower,US,en,www.twitter.com/faoisejdfo/oijsd.html
749,B0035YE9CS,A2PXWG7EVCNJ9H,Robert,1305244800,"I watched an episode o ""How Things are Made"" on Discovery Channell and saw Bluegrass Soy Sauce featured.  On a whim, I ordered a bottle.  It took several weeks to arrive, but when it did - what a surprise.  My teenage son wanted to try it, and did.  He loved it immediately.  Now he puts it on many things. My wife and I were very pleasantly surprised and liked it very much.  In the past, I made many trips to the Far East and developed a real liking for Soy Sauce (where virtually all of it is made).  What a treat to find a handmade American product, that competes with (and wins), against a Japanese/Chinese national staple!",1.0,1,2020-12-12,0,0,cauliflower,US,en,www.twitter.com/faoisejdfo/oijsd.html
750,B0035YE9CS,A7H19XVU8BGKB,Robert Ritter,1314489600,"My bottle arrived just in time for a sushi dinner and game night planned with friends.  I had three soy sauces to choose from.  After some sampling we were all using the Bluegrass!  Everyone enjoyed the light smoothness a subtle sweetness.  We were splashing right on every piece, rather that dunking/dipping. Friends wanted to know where I found it. I'm going back to order more right now, and I'll be ordering 3 extra bottles because they are going to make a great little gift that's affordable and unique; instead of the traditional bottle of wine that so common it's boring.",1.0,0,2020-12-12,0,0,cauliflower,US,en,www.twitter.com/faoisejdfo/oijsd.html
751,B0035YE9CS,A34O62IDVYW7X9,"Mark P. Stevens ""Utard""",1348876800,If you enjoy the flavor of soy you will really like this.<br /><br />Plus its hand made in the good ole USA.,1.0,0,2020-12-12,0,0,cauliflower,US,en,www.twitter.com/faoisejdfo/oijsd.html
752,B0035YE9CS,A3GK03NK0A7GHQ,"J. Lyman ""amazon addict""",1348704000,I recently acquired a bottle of this and was immediately impressed.  It has good flavor without all the excessive saltiness of supermarket brands.  I've used it for marinades and dipping sauces in addition to straight use and in all cases it has added a little something extra.  Quite a surprise to find an American made soy sauce that tastes this good!,1.0,1,2020-12-12,0,0,cauliflower,US,en,www.twitter.com/faoisejdfo/oijsd.html
753,B0035YE9CS,A1MG1L05INR6K,"ertrstso ""furbabies""",1346371200,"This soy sauce is the best we have ever had.  Thanks to Amazon, we were able to find it again.  It makes a big difference when using this product.  Thanks again",1.0,0,2020-12-12,0,0,cauliflower,US,en,www.twitter.com/faoisejdfo/oijsd.html
754,B0035YE9CS,A2ZVXWYWGSEIVF,"Teresa C. Holder ""Cook book Gatherer""",1305072000,This is the most delicious soy sauce I have ever tasted.  I will surely order it again.  Such deep flavor.,1.0,0,2020-12-12,0,0,cauliflower,US,en,www.twitter.com/faoisejdfo/oijsd.html
755,B0035YE9CS,AGXFRN1RZKI4J,Earl Hudson,1321228800,"Saw this on How it is made, which was a very interesting process.<br />Decided to give it a try, I really enjoy the flavor it adds.<br />Looking forward to trying it on several more dishes.<br />Thanks to those who brewed it!",1.0,0,2020-12-12,0,0,cauliflower,US,en,www.twitter.com/faoisejdfo/oijsd.html
756,B0035YE9CS,A1Z1RVRG9CFCB7,taostalk,1343779200,most soy sauce is from Japan but they are having problems with radiation in their soy bean fields. I am not sure how long the contamination will last. I like the idea this product claims no GMO seeds. yea  You pay more but decided not to take a chance on Japan.,1.0,1,2020-12-12,0,0,cauliflower,US,en,www.twitter.com/faoisejdfo/oijsd.html
